video_id,file_path,duration,frame_rate,resolution,motion_score,motion_variance,motion_tag,mood_tag,semantic_tags,formal_tags,emotional_tags,material_tags,dominant_colors,semantic_caption,ai_description
Arthur Russell â Soon-To-Be Innocent Fun (1985)_prores_scene_005,/Volumes/CORSAIR/SCENES/Arthur Russell â Soon-To-Be Innocent Fun (1985)_prores_scene_005_hap.mov,25.98,23.976023976023978,480x268,35.804,30.431,dynamic,neutral,"cell_phone, dynamic_movement, gesture, hand, monochrome, object, unidentified, video","foreground_focus, hand_in_front_of_camera, holding, monochrome, raised_hand",neutral,soft_lighting,"#938c80, #f3f3f5, #161614",a person's hand holding something in his or her hand | a person's hand in the air - video  | a person's hand is held in front of the camera | a black and white image of an object in the foreground | a woman's hand is holding her cell phone in her hand,"A grayscale video depicting various hand gestures and interactions. One segment shows a hand clutching an unidentified object, with only part of the object visible within the grasp of the fingers. Another segment displays a hand raised upwards, possibly in a gesture of reaching out or signaling. The third segment centers a hand presented prominently in front of a camera, suggesting an exhibition or demonstration. The background is indistinct, putting full emphasis on the hand and the object. A separate scene shows an object in sharp focus, with blurred surroundings that contribute to its prominence. Lastly, a woman's hand is seen securely holding a cell phone, likely in the midst of use. The video's motion is dynamic, with hands moving fluidly and purposefully in each frame."
Skateboarding Michigan Dad Friends Frank_prores_scene_019,/Volumes/CORSAIR/SCENES/Skateboarding Michigan Dad Friends Frank_prores_scene_019_hap.mov,6.87,29.97002997002997,704x480,48.806,37.131,dynamic,neutral,"monochrome, skateboarder, street, tracks, train","contrast, motion, side_by_side",neutral,"asphalt, concrete, steel","#313820, #829450, #a6b0ae",a man skateboarding down the street with his skateboard | a train traveling down the tracks | a black and white image of an image,"A man rides a skateboard on a street; parallelly, a train moves on its tracks. Both the skating man and the train exhibit motion. A separate black and white image shows an undefined subject."
Planar Pavillions_prores_scene_004,/Volumes/CORSAIR/SCENES/Planar Pavillions_prores_scene_004_hap.mov,6.83,59.94,1920x1080,38.878,114.116,dynamic,warm,"desert, house, isolation, mountains, sand_dunes","contrast, depth_of_field, monochrome, silhouette, wide_angle","melancholy, serenity, solitude","sand, stone, wood","#b59772, #6d523e, #13151d",a view of the sand dunes of california | a view of the desert and mountains in california | a black and white image of an empty house in the desert,"Undulating sand dunes beneath a vast desert sky, merging with rugged mountains in the distance, framing an isolated, forsaken house stripped of color."
Untitled8 copy_prores_scene_002,/Volumes/CORSAIR/SCENES/Untitled8 copy_prores_scene_002_hap.mov,71.84,29.97002997002997,704x480,56.291,140.803,dynamic,cool,"airplane, clouds, forest, galaxy, planets, stars, sun, sunbeam","blurred, monochrome, natural_light, spherical","expansive, mysterious, serene","aerial, celestial, cosmic, natural","#383a41, #edf3fb, #8892a4",a blurred image of trees in the forest | a black and white image of an airplane flying in the sky | a sunbeam through the window of an airplane | a spherical galaxy in space with stars and planets | a sun shining through the clouds in the sky,"Blurred trees, monochrome airplane aloft, sunbeam piercing airplane window, celestial galaxy, sun filtering through clouds."
IMG_1876_prores_scene_003,/Volumes/CORSAIR/SCENES/IMG_1876_prores_scene_003_hap.mov,5.54,29.96,720x1280,66.535,1.769,dynamic,warm,"abstract, blur, monochrome, patriotic, rug","blue, dynamic, red, warm_tone, white","cozy, inviting","fabric, photo_paper","#d8cec9, #2f292e, #8d7f75","a red, white and blue rug on the floor | a blurred image of an object | a black and white image of an image","The floor is adorned with a rug featuring a patriotic red, white, and blue pattern. In the background, there is an object whose details are obscured by blurring, making it indistinguishable. A wall in the scene holds a framed black and white image which offers an abstract representation of some subject. The room's ambiance is characterized by dynamic movements, possibly from passing shadows or light reflections, giving the sense of ongoing activity. The color mood of the space is warm, suggesting the presence of lighting that casts a cozy and inviting glow, possibly with a golden hue."
pre-ascent-waves_scene_007,/Volumes/CORSAIR/SCENES/pre-ascent-waves_scene_007_hap.mov,52.09,29.97002997002997,1920x1080,40.514,59.991,dynamic,cool,"ocean, sea, shore, waves","close_up, cool, dynamic","powerful, soothing","foam, water","#c9c5c8, #525a5e, #939498","a close up view of the ocean waves crashing against the shore | symphony of waves in the sea - stock video,  footage | symphony of waves in the sea - stock image","Close-up of waves rhythmically crashing onto shore, with splashing foam and swirling water."
Christmas Singalong_prores_scene_037,/Volumes/CORSAIR/SCENES/Christmas Singalong_prores_scene_037_hap.mov,5.41,29.97002997002997,720x480,18.421,286.93,active,cool,"abstract_geometry, airplane_silhouette, black_and_white_photography, snow_covered_road, tree_line, winter","high_contrast, horizontal_lines, monochrome, silhouette, symmetry","coldness, isolation, tranquility","canvas, paper, photographic, snow","#a4a2ab, #0a0e1b, #313d5d",an image of a white square with black lines on it | a snowy road with trees and trees in the background | a black and white image of an airplane flying in the sky,"The scene unfolds across three distinct juxtapositions; a white square canvas is overlaid with a stark grid of black lines creating a geometric pattern. Next, a tranquil yet stark winter landscape stretches out, where a road blanketed in snow wends its way among dormant, snow-draped trees receding into the distance. Lastly, the silhouetted form of an airplane is captured against the sky, rendered in black and white, implying an old photograph or film. The motion feels still in the first, gently dynamic as suggested by the undisturbed snow in the second, and carries a suggestion of motion from the airplane in the last. The cool color mood permeates the scene with a collective sense of coldness, accentuated by the monochrome palette and crisp lighting, generating an atmosphere that is stark and somewhat isolated."
57570068841__98551F3C-F2AF-4EF8-BC23-A7B8ACB06088_prores_scene_001,/Volumes/CORSAIR/SCENES/57570068841__98551F3C-F2AF-4EF8-BC23-A7B8ACB06088_prores_scene_001_hap.mov,12.61,29.97002997002997,1080x1920,23.416,199.368,active,cool,"auditorium_ceiling, background_presence, blue_laser, dancing_crowd, laser_beam, low_light, monochrome, people_group","cool_lighting, dim_lighting, monochrome, motion, sharp_contrast, spatial_depth","contrast, cool, energetic","dark_ambient, photographic_texture, projected_light","#170529, #c24d66, #0100ad",a laser beam is projected onto the ceiling of an auditorium | a crowd of people dancing in the dark | a blue laser beam streaks across the sky | a black and white image of two people standing in front of an image | a group of people in the background of an image,"In the auditorium, a laser beam illuminates the ceiling while a crowd of individuals dance energetically below in a dimly lit environment. The cool-hued laser streaking through the sky suggests a night scene with minimal light pollution, allowing the beam to stand out sharply. Meanwhile, two people are depicted in a static, black and white photograph, drawing a stark contrast with the vivid movement around them. In the background, a blur of figures suggests a group of people in motion, possibly contributing to the spatial depth of the scene."
Skateboarding Michigan Dad Friends Frank_prores_scene_023,/Volumes/CORSAIR/SCENES/Skateboarding Michigan Dad Friends Frank_prores_scene_023_hap.mov,5.01,29.97002997002997,704x480,29.804,888.308,active,cool,"bike, motion, ramp, riding, sidewalk, skateboarder","concrete, natural_light, outdoor, urban_environment","cool, energetic, youthful","metal_bike, wooden_skateboard","#323528, #858c92, #dcdccf",a skateboarder is riding down the ramp | a man skateboards down the sidewalk | a skateboarder is riding his bike down the sidewalk,"A skateboarder glides down a concrete ramp, another cruises on a skateboard along a sidewalk, and a third rides a bike on the pavement."
Untitled8_prores_scene_015,/Volumes/CORSAIR/SCENES/Untitled8_prores_scene_015_hap.mov,7.16,29.87,654x480,54.124,0.112,dynamic,cool,"airplane, bird, monochrome, out_of_focus, silhouette, sky","background, close_up, dynamic, foreground, monochrome","cool, free, serene","clouds, feathers, metal","#5a6369, #fcfdfd, #7b848f",a bird flying in the sky | a black and white picture of an airplane flying in the sky | a close-up of an object in the foreground,"A bird soars in the spacious sky, below an airplane captured mid-flight; both are in sharp silhouette against a clouded backdrop in monochrome. The object in the foreground is out of focus."
IMG_9256_prores_scene_001,/Volumes/CORSAIR/SCENES/IMG_9256_prores_scene_001_hap.mov,8.61,29.97002997002997,720x1280,3.844,12.539,still,neutral,"airplane, low_light, monochrome, sky","monochrome, static",neutral,photograph,"#010002, #21171c, #000000",a black and white image of an airplane flying in the night sky,A monochromatic image showcasing an airplane in mid-flight against a dark night sky backdrop.
Amy's Surprise Birthday_prores_scene_005,/Volumes/CORSAIR/SCENES/Amy's Surprise Birthday_prores_scene_005_hap.mov,91.19,29.97002997002997,704x480,38.892,12.026,dynamic,cool,"backyard, frisbee, group_dynamic, outdoors, play, trampoline","energetic, mid-air, motion, overcast_lighting, playful, serene_atmosphere","comfortable, engagement, joyful","frisbee_plastic, trampoline_mesh","#b9c4d2, #0c0c0b, #67675e",a group of people are jumping on trampoline | a woman and girl playing frisbee | a trampoline in the backyard | a group of girls and boys playing frisbee,"The scene depicts a lively outdoor setting where a group of individuals is energetically bouncing on a trampoline, their bodies suspended mid-air with joyful expressions. Adjacent to this, a woman and a young girl are engaged in a playful toss of a frisbee, with the disc in mid-flight between them. Both activities are set in a backyard that features a trampoline as a centerpiece. Separate from this, another mixed group of boys and girls are absorbed in a game of frisbee, with the disc being passed back and forth. The scene is dynamic, capturing the essence of movement and enjoyment. The cool color mood suggests a serene and comfortable atmosphere, with the lighting condition likely being overcast or in the gentle warmth of late afternoon light."
"american_acid_by_flatsitter_||_10.14.2015_||_sugar_city_||_buffalo,_ny (Original)_prores_scene_005","/Volumes/CORSAIR/SCENES/american_acid_by_flatsitter_||_10.14.2015_||_sugar_city_||_buffalo,_ny (Original)_prores_scene_005_hap.mov",29.8,29.97002997002997,1920x1080,4.588,46.08,still,cool,"black_screen, blue_screen, cool_lighting, dark_room, empty_room, monochrome, object, tv_screen, words","color_highlight, dim_lighting, low_contrast, text_presence, visual_media","melancholy, mysterious, solemn, tranquil","light, photograph, screen","#000006, #e9eee9, #1b2868",a blue light shines into the dark room | a black screen with the words 'my train lines' on it | a blue screen in the dark | a black and white image of an object in the dark | a tv screen with words on it | a black and white image of an empty room,"A dark room is faintly illuminated by a blue light. A black screen prominently displays the words 'my train lines'. Another screen glows blue within the obscurity. An indistinct object presents itself in black and white, barely perceptible in the low light. A television screen stands out, the only source of legible words in the murk. Lastly, a black and white photograph depicts an empty room, its details swallowed by shadows."
DSCF2981_prores_scene_001,/Volumes/CORSAIR/SCENES/DSCF2981_prores_scene_001_hap.mov,1.0,30.0,640x480,17.21,0.0,active,warm,"cds, close_up, human_eye, human_face, human_mouth, man_watching_tv, monochrome","eye_detail, facial_expression, interior_detail, monochrome, object_focus, seated_person","absorption, complexity, expressiveness, intrigue, mystery","dental_work, electronic_device, facial_features, iris_pattern, plastic_cds, reflective_surface, tongue_texture, undefined","#230b0f, #4f2919, #7e4732",a close up of the inside of someone's mouth | a person's face with eyes and mouth | a close-up of the human eye | a man is sitting on tv watching cds | a black and white image of an object,"A close-up reveals the intricate interior landscape of a person's mouth, highlighted by the textured surface of the tongue and possibly glimpses of dental work. Adjacent, another facet of human expressiveness is captured in the depiction of a full face, where eyes and mouth suggest a range of potential emotions. The focus then narrows to the detailed structures within a single human eye, its iris patterns and reflections hinting at depth and complexity. Transitioning to a different scene, a man is observed in the act of engaging with technology, seated and absorbed in the process of selecting or viewing CDs in front of a television, possibly indicating a mix of leisure and decision-making. Lastly, the mood shifts as the imagery turns to a monochrome representation of an object, its lack of color and specifics leaving its nature open to interpretation, yet its form and contrast command attention."
Jazz Band 2000_prores_scene_056,/Volumes/CORSAIR/SCENES/Jazz Band 2000_prores_scene_056_hap.mov,5.38,29.97002997002997,704x480,30.772,171.715,dynamic,warm,"ascension, balloons, monochrome, silhouette","high_contrast, low_light, monochrome","moody, mysterious, quiet","air, low_light","#564b46, #141919, #b9a0b3",a person walking in the dark | black and white balloons flying in the air | a black and white image of an image,"A silhouette moves through darkness, amidst ascending speckled balloons; stark contrasts define a monochromatic space."
GP050496_prores_scene_001,/Volumes/CORSAIR/SCENES/GP050496_prores_scene_001_hap.mov,483.5,23.976023976023978,3840x2160,2.475,0.032,still,cool,"built_environment, city, emptiness, field, grass, monochrome, skyline, trees","background, foreground, middle_ground, monochrome, overcast, static","coolness, solitude, tranquility","asphalt, urban_architecture, vegetation","#7d97b1, #4d4e48, #b5c5d1",a view of the city skyline | a field of grass with trees and grass | a black and white image of an empty space | a black and white image of an empty parking lot | a black and white image of an empty field with trees and grasses,"The scene encompasses diverse environments presented in grayscale. Foreground features a grassy field with scattered trees, the middle ground extends to an empty parking lot, while the skyline of a city is visible in the background. No discernible movement conveys a still atmosphere. Overcast lighting casts uniformity over the scene, establishing a cool color mood."
Untitled8_prores_scene_003,/Volumes/CORSAIR/SCENES/Untitled8_prores_scene_003_hap.mov,10.44,29.87,654x480,56.928,36.968,dynamic,cool,"airplane, forest, reflection, sky, tree, water","blurred, contrast, monochrome","poignant, serene, vast","metallic, natural","#d2e0eb, #404741, #78838b",a blurred image of trees in the forest | the reflection of a tree in the water | a black and white image of an airplane flying in the sky,"Out-of-focus trees in a forest, a tree mirrored in water, and a monochrome airplane aloft."
Spontaneous 231 051_prores_scene_001,/Volumes/CORSAIR/SCENES/Spontaneous 231 051_prores_scene_001_hap.mov,5.4,19.62,320x240,5.254,4.111,moderate,warm,"artwork, individual, observing, playing, standing, two_people, video_games","indoor, monochrome, motion, warm_tone","curiosity, engagement, focus",photograph,"#020407, #5e5347, #211e19",a black and white picture of two people playing video games | a man standing in the middle of the room | a black and white image of two people standing in front of an image | a person is standing in front of an image,"Two people engaged in gameplay, one individual stands solo, two figures facing an artwork, one observes an artwork."
00_0022_2013-12-28_005447_prores_scene_004,/Volumes/CORSAIR/SCENES/00_0022_2013-12-28_005447_prores_scene_004_hap.mov,8.44,29.97002997002997,720x480,33.626,93.625,dynamic,cool,"close_up, crystals, ice, rock","contrast, microscale, motion, reflection, texture","cool, quiet, serenity","ice, natural, stone","#667688, #8ca3bb, #373b39",a close up view of ice crystals on the surface of rock,"The camera is positioned intimately close to rock's rough and uneven surface, showcasing the intricacies of ice crystals that have formed there. The crystals glint and gleam, creating a dance of light and shadow across their faceted surfaces as they reflect the ambient light. The dynamic perceptual motion emanates from the subtle shifts in light and the minute expansions and contractions of the ice due to temperature changes, providing a sense of the ice's transient nature. The cool color mood pervades through the blues and whites inherent to the ice, suggesting a chilly temperature and resonating with the emotional mood of stillness and quiet. The lighting conditions are diffuse, softening the edges of the crystals and contributing to the serene quality of the scene."
Untitled5_prores_scene_001,/Volumes/CORSAIR/SCENES/Untitled5_prores_scene_001_hap.mov,1.07,29.94,654x480,35.971,0.0,dynamic,neutral,"airplane, green_squares, monochrome, pattern, sky","monochrome, patterned",neutral,photograph,"#1c5227, #1cca80, #0a0d0a",a black and white image of an airplane flying in the sky | a pattern of green squares in the background,Monochrome depiction of an aircraft midflight with a mosaic of green squares as backdrop.
"Fog Flying - Buffalo, NY - DJI Phantom 3 - February 2017_prores_scene_007","/Volumes/CORSAIR/SCENES/Fog Flying - Buffalo, NY - DJI Phantom 3 - February 2017_prores_scene_007_hap.mov",14.55,29.97002997002997,1280x720,0.161,0.005,still,neutral,"airplane, collage, elephant, monochrome, night_sky, text","background, contrast, photograph, silhouette, static","neutral, nostalgic, tranquil","ink, paper, photographic_print","#000000, #f3f3f3, #7b7b7b",a black and white background with the words | a plane flying in the dark sky | a black and white image of an elephant | a black and white image of an airplane flying in the sky,"A collage displays a grayscale backdrop, with a distinct text overlay, alongside a grainy image of an elephant. Above, an airplane is captured mid-flight against the night sky, both images devoid of color."
Untitled8 copy_prores_scene_018,/Volumes/CORSAIR/SCENES/Untitled8 copy_prores_scene_018_hap.mov,10.52,29.97002997002997,704x480,34.035,124.399,dynamic,cool,"airplane, flight, monochrome, sky","clear_sky, mid-flight, monochrome","isolation, serenity",photograph,"#4f5362, #7984a6, #686f8a",a black and white image of an airplane flying in the sky | a plane flying in the sky,A grayscale image of an airplane in mid-flight against a clear sky backdrop.
Jazz Band 2000_prores_scene_099,/Volumes/CORSAIR/SCENES/Jazz Band 2000_prores_scene_099_hap.mov,5.87,29.97002997002997,704x480,38.006,10.256,dynamic,neutral,"boys, group, monochrome, music, playing, saxophones","dynamic, mid-action, semi-circle","engaged, focused, lively",black_and_white_photography,"#5a5c5c, #1f2222, #adafaf",black and white image of a group of boys playing saxophones,"Several boys arranged in a semi-circle playing saxophones, captured mid-action, suggesting rhythmic movement and a lively scene, despite absence of actual sound and color."
STATIC_prores_scene_001,/Volumes/CORSAIR/SCENES/STATIC_prores_scene_001_hap.mov,1.85,29.97002997002997,490x360,58.419,0.0,dynamic,neutral,"image, ocean, photograph, static, television, waves","monochrome, motion, neutral_tone, side_by_side","ambiguous, nostalgic, tranquil","electronic, paper_or_canvas, water","#646464, #b2b2b2, #191919",a black and white image of an ocean with waves | a black and white image of an old television screen | a black and white image of an image,"An ocean with rhythmic waves, adjacent to a grainy old TV screen presenting static, beside a vague image, possibly a photograph, indiscernible without color or context."
2a5fd492f935b6fc1979779ea4e20201109T081509-0500_16-33-020-597_28246.mj2.p7s_prores_scene_001,/Volumes/CORSAIR/SCENES/2a5fd492f935b6fc1979779ea4e20201109T081509-0500_16-33-020-597_28246.mj2.p7s_prores_scene_001_hap.mov,5.17,12.0,640x556,6.034,22.891,moderate,neutral,"apartment_building, daytime, intersection, pedestrians, traffic, urban","dynamic, motion, steady_flow",neutral,"building, cars, sidewalk, street","#556365, #d3d0c9, #88948c",a car is driving down the street in front of an intersection | a car is driving down the street in front of an apartment building | a street scene with cars driving down the street | a street scene with cars and pedestrians in the background,"A car moves steadily down an urban street, crossing an intersection. Ahead, an apartment building flanks one side of the street, adding to the urban landscape. Various other cars are also in motion, creating a steady flow of traffic. Pedestrians are present on the sidewalks, contributing to the dynamic of the scene. The overall motion is moderate, suggesting a typical city pace. The emotional tone is neutral, with no apparent distress or exuberance from any individuals. Lighting is natural and even, indicating daytime with no notable weather conditions affecting visibility or the scene's tone."
2014-10-19 13.29.40_prores_scene_001,/Volumes/CORSAIR/SCENES/2014-10-19 13.29.40_prores_scene_001_hap.mov,8.8,29.97002997002997,1080x1920,12.692,1.914,moderate,cool,"landscape, locomotive, motion, tracks, train","cool_lighting, moderate_speed, overcast_lighting","somber, tranquil","reflections, steel","#081221, #86b9fc, #1d2f4d",a train on the tracks,"A sleek locomotive glides along the tracks, its steel body reflecting the cool tones of the overcast sky. Trees and landscape whip by at a moderate pace, suggesting the train's consistent, unhurried movement through a rural or semi-urban environment. The cool color mood pervades the scene, with soft blues and grays dominating the palette, while diffuse natural light casts gentle shadows and creates a tranquil, almost somber atmosphere."
Cloud_prores_scene_001,/Volumes/CORSAIR/SCENES/Cloud_prores_scene_001_hap.mov,24.87,30.0,1600x1000,4.554,16.687,still,neutral,"airplane, apple, clouds, monochrome, photograph, sky","aerial_perspective, monochrome, still-life","neutral, serene, surreal","paper, photographic_print","#363636, #7e7e7e, #020202",a black and white image of an airplane flying in the sky | a black and white photograph of clouds in the sky | a black and white image of an apple in the sky,"An airplane is captured mid-flight, etched against a backdrop of clouds in the sky, all rendered in grayscale tones. Below, an out-of-place apple floats in the sky, adding an unexpected element to the aerial scene. The image is devoid of color, creating a timeless feel. There is no motion, as the photograph freezes the subjects in time. The clouds suggest a diffuse lighting scenario, spreading light uniformly across the scene."
C0028_prores_scene_001,/Volumes/CORSAIR/SCENES/C0028_prores_scene_001_hap.mov,8.61,23.976023976023978,1920x1080,2.896,1.936,still,cool,"empty_room, light_and_shadows, low_light, monochrome, video_projection","contrast, illumination, play_of_light, projection, static","cool, desolation, emptiness, tranquility",photograph,"#232424, #8b998f, #09060a",a black and white photograph of an empty dark room | a video projection in the darkness of an empty room | symphony of light and shadows,"An empty room is cloaked in the stillness of darkness, save for a lone video projection which casts a play of light and shadows across the walls. The projector is not visible within the frame, focusing the attention on the ephemeral dance of illumination that fills the space. The overall atmosphere is cool and desolate, lacking any human presence or warmth. The light from the projection introduces the only movement in the otherwise static scene. The stark contrasts between light and shadow create a subtle symphony, animating the room's surfaces with a rhythmic interplay of patterns."
Christmas Singalong_prores_scene_017,/Volumes/CORSAIR/SCENES/Christmas Singalong_prores_scene_017_hap.mov,5.94,29.97002997002997,720x480,21.056,10.93,active,warm,"house, ice, monochrome, nostalgia, old_tv, snow, winter","diffuse_lighting, monochrome, static_movement, visual_texture","chilling, classic_warmth, nostalgic","ice, snow","#896753, #0a0202, #4c301f",a house is covered in snow and ice | a black and white image of an old tv screen showing the snow falling on the screen,"The scene depicts a house ensconced in layers of snow and ice, suggesting a deep freeze that has taken hold. The visualization is monochromatic, presented as an old black and white TV screen with the static of falling snow adding to a sense of chilling movement. Despite the cold imagery, the black and white tones suggest a classic warmth commonly associated with nostalgic cinematography. The light within the scene is diffuse, likely overcast from the snowy weather, contributing to the image's uniform texture."
