video_id,file_path,duration,frame_rate,resolution,motion_score,motion_variance,motion_tag,mood_tag,semantic_tags,formal_tags,emotional_tags,material_tags,dominant_colors,semantic_caption,ai_description
00_0029_2013-12-28_010442_prores_scene_001,/Volumes/CORSAIR/SCENES/00_0029_2013-12-28_010442_prores_scene_001_hap.mov,57.41,29.97002997002997,720x480,49.808,219.984,dynamic,neutral,"bird, flight, ice, nature, owl, perch, rock, trees, winter","close_up, color, composition, depth, lighting, motion, perception","alertness, neutral, tranquility","feathers, ice, natural_elements, wood","#31352a, #dce3e0, #757568",a bird flies through the branches of trees | a bird perched on the branch | a bird perched on the edge of an icy rock | a close-up of an owl perched on the edge of ice,"A bird is observed in various states within natural and wintery settings. Initially, the bird navigates through intertwining tree branches in flight, then is viewed perched steadfast on a tree branch. Subsequently observed is the bird resting on the edge of a frost-covered rock, followed by an intimate view of an owl poised on the icy edge, likely surveying its surroundings."
Amy's Surprise Birthday_prores_scene_001,/Volumes/CORSAIR/SCENES/Amy's Surprise Birthday_prores_scene_001_hap.mov,4.8,29.97002997002997,704x480,5.478,0.0,moderate,cool,"airplane, flight, monochrome, sky","diffused_light, extended_wings, lateral, moderate_perceptual_motion, stable_motion","calm, cool, serene",photography,"#06080b, #000000, #030605",a black and white image of an airplane flying in the sky,"A monochromatic image captures an aircraft in mid-flight, set against the expansive backdrop of the sky. The plane is depicted from a distance, likely in lateral view, with its wings clearly extended. The motion of the airplane is conveyed moderately, suggesting stable forward movement rather than rapid or turbulent motion. The cool color mood implies the visual temperature is on the cooler side, potentially with soft shadows and subdued highlights, which contributes to a serene atmosphere. Lighting conditions could be overcast or diffused, as harsh contrasts typically associated with strong sunlight are unlikely in a cool-toned black and white photograph."
FullSizeRender_7_prores_scene_001,/Volumes/CORSAIR/SCENES/FullSizeRender_7_prores_scene_001_hap.mov,13.07,30.0,1280x720,41.82,54.364,dynamic,neutral,"baseball, bats, field, players, spectators","group, motion, natural_light, spatial_layout, standing","charged, focused, neutral_mood","grass, uniforms, wooden_bats","#bfb395, #2c3242, #728663",a group of baseball players standing on the field with their bats | a baseball field with players and spectators in the foreground,"A vivid image portrays several baseball players dispersed on a neatly manicured field, each holding a bat, poised and ready for action. The viewers can be seen in proximity, adding a layer of depth to the visual hierarchy. The movement across the scene is dynamic, suggesting a game in progress or imminent play. The emotional atmosphere is charged yet focused, with no explicit indicators of the emotional state of the players or spectators. Daylight bathes the field, casting soft shadows and providing neutral, natural lighting."
Concert Band 1998_prores_scene_005,/Volumes/CORSAIR/SCENES/Concert Band 1998_prores_scene_005_hap.mov,9.98,29.97002997002997,704x480,49.247,146.919,dynamic,warm,"airplane, indoor, monochrome, motion, outdoor, stairwell","blur, central_composition, monochrome, soft_shadows","gentle, inviting, nostalgic, vintage","clouds, light, utilitarian_structure, wood_or_metal","#aa9174, #282219, #786241",a black and white image of an airplane flying in the sky | a black and white image of stairwell in the middle of the room | a black and white image of an object that is in motion.,"The scene presents a vintage aesthetic with a monochromatic grayscale tones. In the sky, an airplane is captured mid-flight, its propellers a blur, suggesting movement against a backdrop of clouds. Within an indoor setting, a stairwell stands centrally, its design is utilitarian with an emphasis on function over form, likely within a sparse interior space. Some light filters in, casting soft shadows that accentuate the staircase's geometry. Another image captures an indistinct object in motion, its form blurred by the quickness of movement, making the object's exact nature unclear. The warm lighting adds a gentle, inviting touch to the otherwise stark monochrome imagery, while the dynamic motions captured in each frame contribute to an overall sense of activity."
IMG_2706_prores_scene_002,/Volumes/CORSAIR/SCENES/IMG_2706_prores_scene_002_hap.mov,13.82,29.97002997002997,1920x1080,12.159,18.852,moderate,cool,"cool_lighting, dancing, dark_room, diffused_light, nightclub","colored_light, low_visibility, motion, obscured_features, silhouettes","cool, energetic, mysterious","light_beams, shadows, smoke","#010041, #0201b2, #871f7e",a dark room with blue lights and fog in the background | a nightclub scene with people dancing in the dark,"The scene unfolds in a confined, obscure space with sparse blue lights casting an ethereal glow over moving figures. Amorphous shapes in the fog suggest a dense, misty atmosphere. The people are engaged in rhythmic motion, suggesting dancing in a nightclub environment. Shadows blend into the darkness, creating indistinct boundaries. The overall movement is moderate, not too wild or sluggish, implying a steady beat or tempo in the background typical of such a setting. The mood evoked is one of cool detachment or nocturnal revelry."
0291Q7_prores_scene_001,/Volumes/CORSAIR/SCENES/0291Q7_prores_scene_001_hap.mov,26.86,23.976023976023978,936x702,0.092,0.001,still,warm,"aerial, airplane, fireworks, monochrome, sky, warm_tone","contrast, expansion_pattern, highlight, silhouette, static","quiet, reflective, serene","ink, paper","#000000, #5c2e10, #080000",a plane flying in the sky | a black and white image of fireworks flying in the sky | a black and white image of an airplane flying in the sky,"The scene presents two elements against the sky: a plane in flight and the explosive patterns of fireworks. In this black and white portrayal, the details of the plane and the fireworks are accentuated by the contrasting tones. The plane is caught in a moment of stationary elegance, seemingly hovering, while the fireworks are captured in an instant of expansion, their trails and bursts frozen in time. The light from the plane and the fireworks softly highlights the upper atmosphere, lending a warm tonality to the otherwise monochromatic view."
2014-07-10 23.18.44_prores_scene_001,/Volumes/CORSAIR/SCENES/2014-07-10 23.18.44_prores_scene_001_hap.mov,11.45,29.97002997002997,1080x1920,34.388,50.388,dynamic,cool,"flickering, nostalgia, nostalgic_atmosphere, soft_lighting, static, television, vintage","foreground, monochrome, motion, soft_lighting","cool, nostalgic, quiet","electronic, glass, metal, plastic","#0f0c09, #bbdee8, #3a3e3f",a white and black television screen | a black and white image of an old television set,"An old-fashioned television set occupies the foreground, displaying streaks of static across its black and white screen. The screen adds a subtle dynamic quality with the flickering white noise, while the rest of the scene is static. The television, with its bulky body and prominent dials, reflects a cool, nostalgic atmosphere. Diffused, ambient light softly illuminates the room suggestive of an overcast afternoon, providing just enough light to wash over the scene without creating harsh shadows or bright highlights."
Couch 2_prores_scene_013,/Volumes/CORSAIR/SCENES/Couch 2_prores_scene_013_hap.mov,9.18,29.97002997002997,704x480,67.106,150.05,dynamic,neutral,"abstract, airplane, ambiguous, flight, geometric, image, pattern, sky","composition, contrast, depth, dynamic, monochrome, silhouette",neutral,photograph,"#bebebe, #6b6c6b, #1b1b1b",a black and white image of an airplane flying in the sky | a black and white image of an abstract pattern | a black and white image of an image,"The image captures an airplane in mid-flight against a backdrop of expansive sky, showcasing the aircraft's silhouette and the nuances of its design in sharp contrast. Adjacent to this, an abstract pattern displays a complex arrangement of geometric shapes or irregular forms that draw the eye in different directions, creating a sense of depth and movement. The third element of the scene presents an ambiguous image, its content indistinct without further context, yet its form contributes to the overall composition. The dynamism in the scene is palpable, with a prevailing sense of upward or forward motion, implying a snapshot of action frozen in time. The lighting appears even and diffuse, casting no strong shadows, consistent with the neutral color mood of a black and white photograph, which strips the scene of color to emphasize texture, contrast, and form."
IMG_5232.MOV_prores_scene_001,/Volumes/CORSAIR/SCENES/IMG_5232.MOV_prores_scene_001_hap.mov,4.27,29.96,200x352,27.243,0.0,active,cool,"dark_room, dj_booth, green_laser, light_symphony, purple_lights, shadows, stage, strobe_lights","central_composition, contrasting_elements, cool_lighting, dynamic_lighting","cool, energetic, vibrant","metallic_surfaces, smoke_machine_effects, specular_highlights","#8000fe, #04a595, #0a5757",a stage with purple lights and strobes | a green laser beam is projected into the dark room | a dj set up in the middle of the stage | a symphony of light and shadows,"A stage is bathed in the cool hues of purple lights and interspersed with the rhythmic flashing of strobes. Within the dark room, a singular green laser beam cuts through the space, adding a sharp contrast to the otherwise abstract play of lights. Centrally positioned is a DJ setup, possibly including turntables and a mixer, surrounded by a symphony of light and shadows that dance to the beat of the music."
2_prores_scene_001,/Volumes/CORSAIR/SCENES/2_prores_scene_001_hap.mov,49.5,30.0,2160x3840,38.395,9.243,dynamic,cool,"ocean, sailboat, sailing, sea, surfboard, surfer, waves","cool_lighting, dynamic, natural_light, open_composition, water_texture","adventurous, exciting, serene","fabric, foam, water, wood","#838a94, #b1b3b6, #4e5a6a",a man is riding his surfboard in the ocean | a surfer riding waves in the ocean | sailor on a sailboat in the sea,"A surfer is actively navigating a wave on his surfboard, harnessing the power of the ocean's movement. The ocean's vast expanse surrounds him, and the scene is imbued with the coolness of blues and greens. The sun casts a soft, diffuse light that catches the water's surface, creating a tranquil yet vibrant atmosphere."
001321_prores_scene_001,/Volumes/CORSAIR/SCENES/001321_prores_scene_001_hap.mov,30.61,23.976023976023978,936x702,5.08,6.544,moderate,cool,"flying, grassy_field, helicopter, hovering, motion, sky","horizon_line, lateral_movement, mid-air, rotation, silhouette","serenity, tranquility, vigilance","metallic_surface, organic_textures","#e9f7fd, #696f34, #101508",a helicopter hovering over the grassy field | a helicopter flies in the sky,"A sleek helicopter hovers with moderate stability above a lush grassy field, its rotating blades cutting through the cool, crisp air. Above, the same helicopter transitions into forward flight against a backdrop of a serene sky, suggesting smooth but noticeable movement. The overall ambiance is punctured by a sense of vigilance while remaining tranquil, under a diffused, perhaps overcast light that casts soft shadows and mutes the colors of the landscape."
00_0045_2013-12-28_013944_prores_scene_002,/Volumes/CORSAIR/SCENES/00_0045_2013-12-28_013944_prores_scene_002_hap.mov,32.9,29.97002997002997,720x480,32.94,338.824,dynamic,warm,"airplane, grass, road, sky, trees, truck","abstract, close_up, driving, flying, motion","freedom, movement, warm_lighting","fiber, metal, woodland","#887862, #0e100f, #bfa987",a truck driving down the road | a close up of an airplane flying in the sky | a blurry view of trees and grass,"A truck is captured proceeding along a roadway, framed to afford a sense of steady movement. Cut to a close-up of an airplane with its details sharply in focus, gracefully soaring through a cloud-dappled sky. The scene shifts to present a blur of verdant trees and grass, conveying a rapid passage through a natural landscape."
00023V_prores_scene_001,/Volumes/CORSAIR/SCENES/00023V_prores_scene_001_hap.mov,8.43,23.976023976023978,936x700,9.014,12.373,moderate,warm,"blurred, empty_space, low_light, monochrome, sharp_shadows, soft_glow, subtle_motion","blur, light_and_shadow, monochrome, room_interior","coziness, emptiness, starkness, static, warm_lighting","aircraft_aluminum, airplane_material","#4f2c2a, #e5deda, #0b0301",a dark room with light and shadows | a blurred image of an object | a black and white image of an empty room,"A dimly lit room casts sharp shadows amidst a soft glow emanating from an indistinct source. In the center, an object, its details obscured and edges softened by blur, sits ambiguously. The entire scene, devoid of color, presents in monochrome, emphasizing the starkness of the empty space. There is an overall stillness, but the interplay of light and shadow suggests a subtle, almost imperceptible sway, giving life to the otherwise still atmosphere. The warmth of the lighting contrasts with the potential chill of a room unoccupied, implying a latent coziness at odds with the stark emptiness."
IMG_5778_prores_scene_001,/Volumes/CORSAIR/SCENES/IMG_5778_prores_scene_001_hap.mov,6.02,29.97002997002997,1280x720,20.094,36.042,active,warm,"abstract_pattern, rays, space, spider_webs, squares, time_lapse, triangles","contrast, geometric_shapes, monochrome","ethereal, intrigue, mysterious","light, photography, web","#4a4341, #827873, #28211f",a black and white image of spider webs in the dark | a black and white image of rays moving in space - time lapse | a black and white image of an image | a black and white image of an abstract pattern in the form of squares and triangles,"Delicate spider webs stretch across a shadowy backdrop, interspersed with dynamic streaks of light depicting time-lapse movement in space. An enigmatic image is paired with an abstract design of geometric squares and triangles."
IMG_7485_prores_scene_002_1,/Volumes/CORSAIR/SCENES/IMG_7485_prores_scene_002_1_hap.mov,16.9,30.0,720x1280,43.13,160.312,dynamic,neutral,"elephant, grass, monochrome, outdoors, puppy","close_up, full_body, image, natural_light, photograph","neutral, playful, tranquil","flora, fur, skin","#d9d4d1, #464f51, #9ba398",a black and white puppy standing in the grass | a black and white image of an elephant in the grass | a black and white dog is playing with another dog in the grass | a close-up of an elephant's head,"A black and white image with a playful puppy, a tranquil elephant walking, and a close-up of its head, all set outdoors in sunlight."
IMG_5589_prores_scene_001,/Volumes/CORSAIR/SCENES/IMG_5589_prores_scene_001_hap.mov,14.41,29.97002997002997,720x1280,8.25,5.268,moderate,neutral,"automobile_interior, beverage, commercial_brand, roadside, urban_environment","daytime, diffuse_lighting, foreground_focus, motion, neutral_colors","everyday, ordinary, unadorned","branded_label, liquid_contents, plastic_bottle","#191e1d, #6d7752, #b0b892",a bottle of gatorade sits on the dashboard of your car | a bottle of gatorade in nyc | a bottle of gatorade is sitting on the side of the road,"A moderately worn Gatorade bottle, displaying the iconic branding, rests on the curved edge of a car dashboard, bathed in the diffuse light typical of an overcast sky. Another bottle stands out on the bustling streets of New York City, with the silhouette of the urban skyline in the background. A third bottle lies abandoned at the periphery of a tarmac road, with occasional vehicles passing by, creating rhythmic motion blurs."
Untitled7_prores_scene_005,/Volumes/CORSAIR/SCENES/Untitled7_prores_scene_005_hap.mov,52.38,29.97002997002997,654x480,32.478,220.406,dynamic,cool,"airplane, background, bird, close_up, cloudy, foreground, monochrome, sky, webcam","contrast, dynamic, focus, monochrome, movement","cool, serene","clouds, feathers, glass, metal, plastic","#e0eaf4, #5d666f, #8692aa",a bird flying in the sky | a black and white image of an airplane flying | hd webcam view of a cloudy sky | a close-up of an object in the foreground,"A bird glides across the sky, while elsewhere, an airplane is captured mid-flight in grayscale. A webcam reveals a cloudy sky, and an object is in sharp focus against a blurred background."
Untitled6_prores_scene_001,/Volumes/CORSAIR/SCENES/Untitled6_prores_scene_001_hap.mov,0.95,24.19,654x480,37.073,0.0,dynamic,warm,"airplane, bird, blurred, close_up, distance, flying, foreground, monochrome, motion, sky","composition, contrast, depth, dynamic, monochrome","liveliness, serenity, warm_lighting","absence_of_color, absence_of_light","#908570, #4d534f, #706e65",a bird flying in the air | a blurred image of an object in the distance | a black and white image of an object in motion | a close-up of an object in the foreground | a black and white image of an airplane flying in the sky,"A grayscale depiction shows a bird in flight, with a blurred entity in the distance. An indistinct object is captured mid-motion, and there's a detailed foreground object. Above, a monochrome airplane soars."
2015-09-22 20.11.10_prores_scene_001,/Volumes/CORSAIR/SCENES/2015-09-22 20.11.10_prores_scene_001_hap.mov,6.8,30.0,640x640,66.648,11.871,dynamic,warm,"book_cover, monochrome, poster, triangle_composition, unicorn","contrast, embossed, emerging, three-dimensional","dynamic, powerful, warm_lighting","ink, paper","#d1683c, #fdf8f2, #3b1b17",unicorn hard on a poster with the word unicorn on it | the unicorn hard - on a black and white background | unicorn hard on the cover of a book | the composition of the image is based on the shape of a triangle,"A vibrant poster featuring an embossed unicorn in the center, prominently displaying the word 'UNICORN' above it. The background is divided equally into black and white sections, sharply contrasting with the unicorn figure. This same image is replicated on a book cover, preserving the color scheme and central focus on the unicorn. The entire composition creates an implied triangle from the top of the poster to the base of the book cover. The depicted scene conveys a sense of dynamic motion as if the unicorn is emerging powerfully from the surface, accentuated by the warm color palette of the unicorn itself against the monochromatic background. The lighting highlights the unicorn, giving it a three-dimensional effect and enhancing the warmth of the colors."
2014-08-17 18.53.50_prores_scene_001,/Volumes/CORSAIR/SCENES/2014-08-17 18.53.50_prores_scene_001_hap.mov,32.31,29.97002997002997,1080x1920,40.656,40.131,dynamic,warm,"computer_monitor, empty_living_room, furniture, keyboards, mice, monochrome, multiple_monitors, open_window, red_blanket, wooden_table","casual_spread, center_placement, contrast, duality, reflection, shared_space","coziness, dynamic, homeliness, inviting, productivity, readiness","electronic, photographic, sunlit, textile, wooden","#2c1d15, #877c6b, #cfd1c9","a wooden table with two chairs | a red blanket on the floor | a computer monitor sits in front of an open window | a black and white image of an empty living room | a desk with two monitors, two keyboards and two mouses","A rustic wooden table is complemented by two matching chairs, placed assertively in the room's center, suggesting readiness for dining or conversation. Adjacent to this arrangement, a red blanket is spread casually on the floor, infusing the space with a splash of color and a sense of homeliness. Against the backdrop of an open window stands a computer monitor, its screen likely reflecting the dynamic movement from the outdoors. The room is also graced with a black and white photograph depicting an empty living room, offering a contrast in its stillness. Alongside, a desk is set with dual monitors, keyboards, and mice, implying an atmosphere of shared productivity or gaming. The room's motion feels dynamic, with the potential activity at the desk and the subtle shifts of light and shadow from the window. The warm color mood exudes a cozy, inviting aura, amplified by the sunlight that bathes the room, highlighting textures and surfaces with a soft glow."
E60FFEAF-A2D7-4685-8332-712620B55268IMG_0843_prores_scene_001,/Volumes/CORSAIR/SCENES/E60FFEAF-A2D7-4685-8332-712620B55268IMG_0843_prores_scene_001_hap.mov,22.07,15.0,224x128,0.071,0.003,still,warm,"airplane, low_light, monochrome, moon, sky","high_contrast, monochrome, static, two-dimensional","nostalgic, quiet, serene",photographic,"#000000, #060200, #020000",a black and white image of an airplane flying in the sky | a black and white image of the moon in the night sky,"The scene captures an airplane mid-flight against a vast sky, conveying a sense of stillness with no visible movement, juxtaposed with an image of the moon set against the dark night sky, both rendered in grayscale tones."
IMG_5949_prores_scene_001,/Volumes/CORSAIR/SCENES/IMG_5949_prores_scene_001_hap.mov,85.31,29.97002997002997,540x960,24.977,7.27,active,warm,"motion, sydney, tracks, train, travel, tunnel","convergence, dynamic, linear, perspective","progression, vitality, warm_lighting","concrete, glass, steel","#dacca5, #574f3d, #8c7e60",a train is driving down the tracks | a train is driving down the tunnel | a truck is driving down the tunnel | image of a train traveling down the tracks | a train is driving down the tracks in sydney,"A train moves along tracks, its form cutting through a tunnel then emerging in Sydney's warm light."
IMG_0025_prores_scene_004,/Volumes/CORSAIR/SCENES/IMG_0025_prores_scene_004_hap.mov,4.66,24.0,360x480,4.574,0.0,still,cool,"controller, dj, knobs, mixer, music, turntable","foreground_focus, monochrome, soft_shadows, subdued_lighting","cool, focused, subdued",electronic_equipment,"#040317, #140c3c, #d3c483","a dj playing music on his turntable | a dj playing music with his hands on the controller | a hand is touching the knobs of dj mixer | dj mixer - stock images, clipart and vectors | dj mixer with a mixer controller | a black and white image of an electronic dj mixer","A DJ is focused on playing music, hands on a turntable controller, adjusting knobs on a DJ mixer. The image is black and white, highlighting the equipment's contours and suggesting a cool, focused atmosphere. The lighting appears subdued, casting soft shadows that enhance the tactile relationship between the DJ and the mixer. The mixer dominates the foreground, indicating its central role in the scene."
57472266206__C1836BE7-D43B-4D71-BFC0-5DEBA69BBB95_prores_scene_001,/Volumes/CORSAIR/SCENES/57472266206__C1836BE7-D43B-4D71-BFC0-5DEBA69BBB95_prores_scene_001_hap.mov,2.96,24.86,652x872,27.53,0.0,active,warm,"album_collection, artwork, cd_cover","dynamic, juxtaposition, lively, radiant","celebratory, hopeful, mysterious, revelry","paper, plastic, print","#b24f59, #e6b4a2, #4f3b3e",cd cover of the album 'the fucking highlights' | the the wedding highlights - high society fantasy party cd | a box with the cover of the album titled 'the lost light' | cd cover of the album 'shining light' | cd cover of the album 'the fucking night',"A collection of CD covers arrayed against a warm, radiant backdrop. Each cover features dynamic imagery resonant with the album's title. The central focus is on 'The Fucking Highlights' and 'The Wedding Highlights - High Society Fantasy Party' CDs, which exude a vivid celebration energy, juxtaposed with the more mysterious allure of 'The Lost Light.' A CD titled 'Shining Light' reflects a gleaming, hopeful presence, while 'The Fucking Night' introduces a contrast with its suggestion of nocturnal revelry. The atmosphere buzzes with activity, suggested by the motion-centric art of the album covers, and the scene is awash in a warm, amber light that implies a lively, high-class event just beyond view."
00_0047_2013-12-28_014512_prores_scene_001,/Volumes/CORSAIR/SCENES/00_0047_2013-12-28_014512_prores_scene_001_hap.mov,16.42,29.97002997002997,720x480,41.93,46.618,dynamic,cool,"bird, branches, flying, motion, perched, trees","bare_branches, cool_lighting, diffuse_lighting, silhouette","serenity, solitude, tranquility","feathers, twigs, wood","#879598, #2f312b, #5c6462",a bird perched on the branches of trees | a bird flies through the branches of bare trees,"A solitary bird grips a slender twig among the interlacing branches of leafless trees. As the bird launches into the open air, its swift movement creates a dynamic contrast against the static, stark branches. The cool mood is amplified by a color palette of grays and blues, suggesting a wintry or overcast day. The light appears diffuse, lacking strong shadows, and contributes to the overall coolness of the setting."
