video_id,file_path,duration,frame_rate,resolution,motion_score,motion_variance,motion_tag,mood_tag,semantic_tags,formal_tags,emotional_tags,material_tags,dominant_colors,semantic_caption,ai_description
IMG_1385_prores_scene_001_1,/Volumes/CORSAIR/SCENES/IMG_1385_prores_scene_001_1_hap.mov,12.5,30.0,720x1280,23.18,46.961,active,warm,"dog, monochrome, photography, rest, sleeping","close_up, monochrome, two_subjects","peaceful, serene","fur, indoor_lighting","#302d2a, #777a75, #b53f2f",a black and white dog sleeping on the floor | a black and white image of two dogs laying on top of each other,"A black and white photo showing one dog resting on the floor, another atop, both appearing tranquil in a dim, soft-lit space."
GOPR0244_prores_scene_003,/Volumes/CORSAIR/SCENES/GOPR0244_prores_scene_003_hap.mov,14.2,119.86,1920x1080,2.1,0.635,still,cool,"airplane, clouds, cool_lighting, low_light, monochrome, silhouette, sky","contrast, low_key_lighting, monochrome, photography, static","calm, isolation, mystery, serenity","light, shadow","#020104, #143dcb, #040943",a blue light shining in the dark | a black and white picture of an airplane flying in the sky,"A single, intense blue light pierces the darkness, standing out as a beacon in the void. The black and white image captures an airplane mid-flight, its silhouette gracefully positioned against the expanse of the sky, trailing the soft texture of clouds."
Frank's Shows June 18 1999_prores_scene_005,/Volumes/CORSAIR/SCENES/Frank's Shows June 18 1999_prores_scene_005_hap.mov,8.81,29.97002997002997,704x480,25.302,348.084,active,cool,"colors, event, group, lighting, motion, music, performer, stage","cool_hue, dynamic, rhythmic_motion, silhouette, vibrant","chill, energetic, enthusiastic, vivid","fabric, musical_instruments, reflections","#101312, #abaacb, #353649",a band playing on stage in front of an audience,"The stage is bathed in cool-hued lights, predominantly shades of blue and purple, lending a chill yet energetic atmosphere to the scene. A band consisting of a lead singer, guitarist, bassist, and drummer performs, each member exhibiting vigorous, rhythmic movements in sync with their music. The audience, silhouetted against the vibrant stage lighting, is a lively mass, some with hands raised, and others moving to the rhythm. The overall motion on stage is dynamic, with the strumming of guitars, energetic drumming, and the singer's enthusiastic movements commanding attention."
IMG_2388_prores_scene_001,/Volumes/CORSAIR/SCENES/IMG_2388_prores_scene_001_hap.mov,0.96,30.0,1080x1920,7.876,0.0,moderate,warm,"backpack, clothing, empty_room, leather_bag, seated_man, water_bottle","black, leather, monochrome, motion, textile, warm_lighting","cozy, inviting, minimalistic, stark","fabric, leather, metal, water, wood","#12110e, #8d7a62, #4d463a","a black backpack sits next to the water bottle | a black leather bag on the floor | a black backpack, t-shirt, shirt and hat | a black and white image of an empty room | a man is sitting on the floor with his hands on his knees","A moderately dynamic scene featuring a black backpack placed closely beside a water bottle. Adjacent on the floor lies a black leather bag. Nearby, assorted black garments, which include a backpack, a t-shirt, a shirt, and a hat, are spread out. The scene also contains a grayscale image of an empty room reflecting an absence of color, conveying a stark, minimalistic aspect. A man is seen seated on the floor, adopting a static pose with his hands resting on his knees. The scene exudes a warm color mood with lighting that envelops the space in a cozy, inviting glow."
00_0040_2013-12-28_012945_prores_scene_005,/Volumes/CORSAIR/SCENES/00_0040_2013-12-28_012945_prores_scene_005_hap.mov,9.88,29.97002997002997,720x480,44.783,109.977,dynamic,cool,"mask, ocean, scuba_diving, surfing, waves","close_up, cool_lighting, motion, natural_light","energetic, engaged","foam, neoprene, silicone, water","#414849, #757e83, #a4a9af",a close up view of the waves crashing into the ocean | a surf surfer riding waves in the ocean | scuba diving in the ocean with a snorkeling mask,"The image captures the energetic interaction between the ocean and human activities. In the foreground, waves are seen crashing with force, displaying a raw power and the natural rhythms of the sea. The middle plane shows a surfer in a wetsuit, expertly navigating through the crests and troughs of the ocean waves. The surfboard cuts through the water, leaving a trail of white foam. In the background, a figure equipped with a scuba mask is partially submerged, pointing towards an underwater adventure. The scene is imbued with a sense of motion as all elements actively engage with the water. The overall color tone is cool, dominated by blues and greens of the ocean which evoke a sense of calmness despite the active movement. The lighting is soft and diffused, suggesting an overcast sky or the filtering effect of the water's surface above the diver."
MVI_0157_prores_scene_007,/Volumes/CORSAIR/SCENES/MVI_0157_prores_scene_007_hap.mov,4.01,29.96,320x240,51.372,0.0,dynamic,warm,"animal, monochrome, mouth_open, object, wooden_door","background, blur, close_up, foreground, monochrome","energy, warm_lighting","fur, paint, wood","#75695f, #1d110c, #ccc7b5",a close up view of an animal | a close up of an old wooden door | a close up of an object | a close-up of an animal with its mouth open | a black and white image of an object in the foreground,"Tightly framed, an animal with fur has its jaws wide open, in the background, a worn wooden door with peeling paint. An object blurs into monochrome against the warm-lit scene's movement."
IMG_3999_prores_scene_001,/Volumes/CORSAIR/SCENES/IMG_3999_prores_scene_001_hap.mov,4.81,29.97002997002997,1280x720,46.189,0.0,dynamic,neutral,"bear, forest, polar_bear, trees, walking, woods","dynamic, natural_light, neutral_color_mood",unexpected_presence,"flora, fur","#7b8541, #bac378, #2d3714",a bear walking through the forest | a polar bear in the woods,"A polar bear ambles with weight and purpose through a dense forest, dwarfed by the towering trees surrounding it. The bear's movement exhibits a deliberate and powerful grace. The lighting is balanced, casting gentle shadows without overemphasis, creating a tranquil yet slightly unusual setting considering the polar bear's typical habitat."
60487388586__406F5793-61BE-40BF-8D50-67A9DE9E4D2C_prores_scene_001,/Volumes/CORSAIR/SCENES/60487388586__406F5793-61BE-40BF-8D50-67A9DE9E4D2C_prores_scene_001_hap.mov,1.72,23.38,654x872,56.004,0.0,dynamic,warm,"animal, art, canvas, cheetah, grass, light, motion, savannah, warm_lighting","dynamic_composition, golden_light, textured_brushstroke, triptych, warm_palette","energy, tension, vitality, warm_lighting","canvas_fabric, fur, natural_light, paint","#decfbf, #401e15, #a0775b",a cheetah in the grass | an image of a cheetah on canvas | a cheetah in the savannah,"The scene is split into three segments depicting various representations of a cheetah. To the left, a cheetah is crouched low in the tall grass, muscles tensed, poised as if in mid-prowl, embodying a sense of impending velocity. The middle section shows an artistic rendition of a cheetah on canvas, with textured brushstrokes emulating the dynamic energy of the animal. The artist has used a palette of warm colors to capture the creature's essence. To the right, a cheetah in the savannah appears in stride, its limbs blurred in motion against the backdrop of the sunbaked plains, further amplifying the sense of movement. Overall, the scene is bathed in a warm, golden light that enhances the feeling of dynamism and vitality within the warm, earth-toned environment."
00_0055_2013-12-28_025842_prores_scene_001,/Volumes/CORSAIR/SCENES/00_0055_2013-12-28_025842_prores_scene_001_hap.mov,75.3,29.97002997002997,720x480,16.609,115.301,active,warm,"dog, floor, hand, lying, monochrome, motion, object, walking","contrast, lighting, monochrome, movement, shadow, texture","comfort, energy, interaction","fur, skin, tiled_floor, unspecified","#1b140f, #897f72, #49382b",a black and white dog lying on the floor | a dog is walking on the floor | a black and white image of two dogs | a black and white image of an object in motion | a person's hand is holding an object in his or her hand,"The picture showcases a black and white dog lying on its side comfortably on a smooth, tiled floor. Adjacent to the resting dog, another dog is captured in mid-stride, giving the impression of movement across the floor. Both scenes are presented in monochrome tones, emphasizing contours and textures rather than color. Another image displays two dogs, perhaps in an interaction or a play, frozen in grayscale, enhancing the contrasts and shadows that define their forms. Additionally, a black and white photo captures an indistinct object, blurred by its swift motion against a stable background, giving a sense of dynamic energy. Lastly, a person's hand appears, gripping an object securely; details are obscured but the focus is on the interplay of light and shadow over the hand's surface and the shape of the held item."
C0026_prores_scene_001,/Volumes/CORSAIR/SCENES/C0026_prores_scene_001_hap.mov,4.0,23.976023976023978,1920x1080,2.242,0.0,still,neutral,"airplane, light_streaks, monochrome, motion, silhouette, sky","contrast, diffused_light, frozen_motion, neutral_tones, skyline, static","calm, neutral_mood, tranquil","absence_of_color, aircraft_structure, cloudless_sky","#343933, #637367, #070407",a plane flying in the sky | a black and white image of the sky with light streaks | a black and white image of an airplane flying in the sky | a black and white image of an object in motion,"The scene captures an airplane mid-flight in a cloudless sky. The image is in black and white, emphasizing the silhouette of the aircraft against the background. Light streaks are possibly indicative of clouds or motion blur and contribute to the stillness of the scene. The plane's motion is frozen in the frame, giving the impression of suspended animation rather than dynamic flight. There is no visible action or turbulence, suggesting a calm, steady progression through the sky. The lighting conditions are uniformly diffused, with no harsh shadows or highlights, supporting a neutral mood without a strong emotional evocation."
RJ6A0021_prores_scene_005,/Volumes/CORSAIR/SCENES/RJ6A0021_prores_scene_005_hap.mov,8.05,23.976023976023978,1920x1080,60.326,1026.465,dynamic,cool,"animal, face, monochrome, object, silhouette, smartphone","background_subject, close_up, foreground_blur, off-center_composition","introspective, solitude",grayscale_photography,"#191d22, #edf0f4, #7b808f",a black and white picture of someone's face | a man is looking at his cell phone | a close-up of an object in the foreground | a black and white image of an animal,"In a grayscale scene, a man's face emerges, gaze fixed on his smartphone. A blurred object appears prominently upfront, while the silhouette of an animal fades into the background."
IMG_7513_scene_001,/Volumes/CORSAIR/SCENES/IMG_7513_scene_001_hap.mov,13.24,30.0,1080x1920,32.388,72.069,dynamic,warm,"black_dog, close_up, hand-held, poodle_puppy","close_perspective, monochrome, sharp_focus, warm_lighting","affectionate, curious, engaging","fur, lens, skin","#79533e, #c49c6d, #161416",a black dog sniffs at the camera | a black poodle puppy being held by someone's hand | a black poodle puppy looking at the camera | a black and white image of an animal,"Close-up view of a black poodle puppy's face, nose touching the lens, hand cradling the puppy, gaze meeting the camera, all in a monochromatic warm tone."
Frank's Shows June 18 1999_prores_scene_009,/Volumes/CORSAIR/SCENES/Frank's Shows June 18 1999_prores_scene_009_hap.mov,68.94,29.97002997002997,704x480,26.299,90.132,active,warm,"drums, event, group, guitar, monochrome, performer, photography, stage","cluster, dynamic, foreground, lighting, motion, raised_platform, timeless, vibrant, warm_tones","attentive, commanding, energetic, engrossed, motion, passionate","instruments, microphones","#664d2a, #301701, #b79e7b",a man playing guitar in front of two other men | a man playing drums on stage | black and white photograph of a band playing on stage | a group of people standing in front of an image | a man playing drums in front of two other men | a group of people on stage in front of an audience,"In the foreground, a man with a guitar is energetically strumming chords, his body leaning into the rhythm, engaging a duo of attentive men. On a raised platform, a drummer, animated by the beat, hammers on drums, a motion blur capturing his dynamic performance. A black and white image captures a timeless moment of a band in full swing, instruments and microphones implying a rousing concert. A cluster of individuals stands before a vast image, seemingly engrossed by its substance. Another drummer is seen in vigorous play, flanked by a pair of men possibly immersed in the music. A vibrant stage hosts a gathering of performers, their collective presence commanding the audience's attention. The scene exudes activity and warmth throughout, the lighting cast creates inviting and earnest overtones, emphasizing the passion inherent in the acts of musical expression."
C0029_prores_scene_001,/Volumes/CORSAIR/SCENES/C0029_prores_scene_001_hap.mov,5.01,23.976023976023978,1920x1080,4.43,19.62,still,neutral,"black, dark, foreground, lighted_circles, monochrome, object, octopus","composition, contrast, shading, silhouette, texture",neutral,"ink, paper, photographic","#080508, #8aa08f, #3a433b",a black and white image of an octopus in the dark | a black screen with lighted circles on it | a black and white image of an object in the foreground,"An octopus is centered in a dark environment, its silhouette or texture is the only detail visible in shades of gray. Surrounding the octopus image are various lighted circles scattered on a black background, possibly suggestive of bioluminescence or artificial lights. Another object is present, its details obscured except for its outline or contrasting shades, making it the focal point in the foreground."
00_0043_2013-12-28_013531_prores_scene_001,/Volumes/CORSAIR/SCENES/00_0043_2013-12-28_013531_prores_scene_001_hap.mov,68.7,29.97002997002997,720x480,28.127,327.424,active,neutral,"airplane, blur, descent, kite, motion, outdoor, silhouette, skateboarder, sky, trees","background, blur, color, foreground, middle-ground, monochrome",neutral,"fabric, grass, metal, wood","#4c6a7f, #2e2e1d, #43412f",a skateboarder riding down the slopes of trees | a plane flying over trees | a kite flying in the sky | a black and white image of an airplane flying in the sky | a blurred image of trees and grasses,"The scene captures a dynamic outdoor setting filled with activities and objects in motion above the ground. In the foreground, a skateboarder is swiftly descending along rolling slopes dotted with trees, implying a sense of speed and agility. Above, an airplane traverses the sky, leaving a faint trail as it moves over the lush canopy of trees. Near the top of the frame, a colorful kite dances in the azure sky, adding a playful element to the vista. Additionally, a separate visualization presents an airplane as a black and white silhouette against the cloudy heavens, evoking a vintage or historical feel. In the periphery, the foliage of trees and grass merges into a soft blur, creating a contrast that accentuates the clarity of the moving figures. The overall mood is neutral, lacking a specific emotional charge, while the lighting appears natural and evenly spread, possibly suggesting a clear or slightly overcast day with no harsh shadows."
2014-10-19 13.28.59_prores_scene_001,/Volumes/CORSAIR/SCENES/2014-10-19 13.28.59_prores_scene_001_hap.mov,12.8,120.0,720x1280,7.338,0.785,moderate,cool,"background_movement, california, graffiti, tracks, train_car","abandoned, desolate, distant, motion, vibrant_colors","loneliness, static, tranquility","metal, paint","#8dbbfb, #040f19, #263d58",a train car on the side of an empty train | a train on the tracks in california | a train car with graffiti on it | a train is traveling down the tracks in the background,"A solitary train car sits abandoned on a desolate stretch of tracks, its surface a canvas for vibrant graffiti. In the distance, another train glides steadily along the rails, cutting across the California landscape. The scene is imbued with a cool color mood, suggesting either an overcast sky or the soft light of early evening. The predominant motion is moderate, with the background train providing a sense of movement within an otherwise static scene."
MVI_0293_prores_scene_002,/Volumes/CORSAIR/SCENES/MVI_0293_prores_scene_002_hap.mov,64.64,29.97002997002997,320x240,32.008,77.366,dynamic,cool,"car, highway, mountains, nevada, train","dynamic, motion, view_from_train","cool, serene","asphalt, glass, metal","#303432, #a5cae8, #797a56",view from the window of a train or train train | a car driving down the highway in the mountains of nevada,"A car navigates a highway amidst Nevada's mountainous terrain; seen from a train window where the indication of speed is palpable, bathed in cool, diffused light."
Untitled4_prores_scene_001,/Volumes/CORSAIR/SCENES/Untitled4_prores_scene_001_hap.mov,6.23,29.54,654x480,66.51,30.476,dynamic,neutral,"abstract_patterns, airplane_silhouette, monochrome, pixels, squares, telecommunications","abstract, dynamic, fluctuating, geometric, monochrome, pattern",neutral,"tv_screen, video_footage, visual_texture","#121412, #cdd1cc, #727772",a black and white pattern of squares of telecommunications - stock video footage | an image of a black and white tv screen | a black and white pattern of squares of pixels | a black and white image of an abstract pattern of squares and triangles | a black and white image of an airplane flying in the sky,"A grayscale geometric pattern fluctuates dynamically across the screen, interspersed with abstract shapes and a silhouette of an airplane."
0001QS_prores_scene_001,/Volumes/CORSAIR/SCENES/0001QS_prores_scene_001_hap.mov,7.6,23.976023976023978,936x702,57.916,1985.193,dynamic,neutral,"field, hand, monochrome, motion, object, trees","background, blurred_motion, foreground, monochrome",neutral,"grass, skin, sky, unknown","#f4f7cd, #0e120b, #757b57",a grassy field with trees in the background | a person's hand holding something in the air | a black and white image of an object in motion.,"A vast expanse of green grass spreads out across the scene, interspersed with occasional tall trees standing against the skyline in the background. In the foreground, a human hand is raised, holding an indistinct object aloft. This object, captured in a monochromatic scheme, gives the impression of movement, blurring slightly as if caught in the midst of action. The scene's dynamism is focused on the motion of this object. The color mood is neutral, characterized by a balance of light and shadow, suggesting an overcast or diffused lighting situation without strong sunlight or discernible shadows."
002385_prores_scene_002,/Volumes/CORSAIR/SCENES/002385_prores_scene_002_hap.mov,19.1,59.94,936x700,6.172,2.179,moderate,neutral,"altitude, flight, ground, helicopter, runway, sky","motion, natural_light, neutral_colors",neutral_emotion,air_vehicle,"#f3fbfb, #6d7633, #0c1108",a helicopter flies down the runway | a helicopter flies in the sky | a helicopter flies over the ground,"A helicopter is depicted three times in varying aerial positions relative to the ground. In the first instance, the helicopter hovers closely along a runway, indicative of either taking off or preparing to land. The second image shows the helicopter at a higher altitude in the sky, mid-flight with no reference to the ground. In the third, the helicopter is seen at an intermediate height above the terrain, emphasizing its overland flight. The motion is moderate, suggesting controlled and purposeful movement. The color mood is neutral, neither particularly vivid nor subdued, with natural lighting that doesn't cast dramatic shadows or provide strong contrasts."
IMG_0025_prores_scene_005,/Volumes/CORSAIR/SCENES/IMG_0025_prores_scene_005_hap.mov,7.83,24.0,360x480,3.926,0.006,still,cool,"dj_equipment, entertainment, mixer, music, turntables","high_contrast, low_key_lighting, monochrome, still_life","cool, focused, minimalistic","electronic, metal, plastic","#030216, #0b0b3e, #d4cc9d",a black and white dj set up in the dark | a black and white image of an electronic dj set,"A DJ setup enveloped in darkness, featuring equipment such as turntables, mixer, and possibly laptops, rendered in shades of black, gray, and white. The equipment surfaces reflect soft ambient light. The dark backdrop accentuates the essential gear, with no discernible figures or additional accessories visible, highlighting the starkness and simplicity of the composition."
IMG_6512_prores_scene_001,/Volumes/CORSAIR/SCENES/IMG_6512_prores_scene_001_hap.mov,23.9,30.0,1920x1080,9.038,9.517,moderate,warm,"airplane, led_screen, low_light, photograph, red_light","blur, contrast, illumination, monochrome","anticipation, mystery, timelessness","led, photographic_paper, soft_lighting","#060000, #4d0004, #d6687b",a red led screen in the dark | a red light shines in the dark | a black and white picture of an airplane flying in the sky | a black and white image of an object in the dark,"A moderate blur conveys movement as a splash of red illuminates the darkness from an LED screen, creating a feeling of anticipation. Above, a grainy black and white photograph captures the timeless motion of an airplane soaring through the sky, encapsulated in a moment of flight. The object in the dark remains ambiguous, bathed partially in shadow and mystery."
IMG_0334_prores_scene_001,/Volumes/CORSAIR/SCENES/IMG_0334_prores_scene_001_hap.mov,6.18,25.1,1280x720,29.498,274.548,active,warm,"dj, lights, projections, stage","centered, dynamic, low_light, warm_hues","energetic, immersive, lively","dj_equipment, light_beams, shadows, strobes","#2d0713, #ad2330, #8369a7",a stage with lights and projections in the background | a dj set up in the dark room | djs on stage in a dark room with lights | a dj set up in the middle of the stage,"A dimly lit stage radiates with warm hues, centered around a DJ booth that commands attention amidst the darkness. The beams of light create dynamic patterns in the background, blending with shadows and the occasional strobe effect. DJs are present, immersed in their craft, as the equipment pulsates with the rhythm of the music. The overall atmosphere is one of energetic activity, resonating with the vibe of a lively music event."
Statics_4_prores_scene_001,/Volumes/CORSAIR/SCENES/Statics_4_prores_scene_001_hap.mov,2.96,24.66,1280x720,33.276,0.0,dynamic,cool,"ground, ice_cubes, monochrome, raindrops, static, tv_screen, water","close_up, high_contrast, texture","melancholic, reflective","electronic, frozen, liquid","#858187, #211e22, #4a474c",a black and white image of the tv screen | a close up of rain drops falling on the ground | a black and white image of an image | a black and white image of ice cubes floating in water,"In a grayscale tableau, raindrops plummet and splash on pavement, a TV screen looms silently, a vague image implies stillness, and ice cubes bob in water with gentle undulations."
00_0030_2013-12-28_010701_prores_scene_001,/Volumes/CORSAIR/SCENES/00_0030_2013-12-28_010701_prores_scene_001_hap.mov,120.92,29.97002997002997,720x480,8.893,42.928,moderate,warm,"animal_motion, bird, close_up, flight, lichens, monochrome, moss, oak_tree, perch, tree_trunk, wild_animal","air, bark, color, image, lighting, motion_quality, side, texture","tranquil, vibrant, warm_lighting","feathers, organic_growth, wood","#595d39, #373a1f, #b68665",a bird flying in the air | a bird perched on the side of an oak tree | moss and lichens growing on the bark of a tree trunk | a black and white image of an animal in motion | a close-up of an animal in the wild,"A bird soars through the sky, its wings outstretched in fluid motion, while another bird rests on the rugged surface of an oak tree's branch. The tree's trunk is textured with moss and lichens, adding a sense of age and vitality to the scene. The monochromatic portrayal of an unidentified animal suggests dynamic movement. The close-up of a wild animal reveals intricate details, possibly of fur or feathers, hinting at a natural, untamed essence. The overall moderate motion, coupled with warm lighting, conveys a tranquil yet vibrant atmosphere."
IMG_1578,/Volumes/CORSAIR/SCENES/IMG_1578_hap.mov,7.31,29.97002997002997,1280x720,21.992,40.253,active,cool,"ceiling_projection, dark_night, laser_light_show, light_beam, silhouette","contrast, illumination, monochrome, texture","cool_lighting, mysterious","laser_light, low_light","#19135c, #5f10d3, #0c8c81",a laser light beam is projected onto the ceiling of the room | light beams in a laser light show | a black and white image of an object in the foreground | a green laser light shining in the dark night sky,"A pointed laser beam zigzags across a ceiling, while the night sky outside is pierced by a green laser ray. Foreground shows a silhouette, all in monochrome tones."
