video_id,file_path,duration,frame_rate,resolution,motion_score,motion_variance,motion_tag,mood_tag,semantic_tags,formal_tags,emotional_tags,material_tags,dominant_colors,semantic_caption,ai_description
MVI_0725_prores_scene_001,/Volumes/CORSAIR/SCENES/MVI_0725_prores_scene_001_hap.mov,48.31,29.97002997002997,1280x720,11.651,1.437,moderate,cool,"fish, swimming, water","motion, spatial_layout","cool, serene","natural_light, underwater_lighting","#8a8f8f, #797e86, #99a09c",a small fish swims in the water,"A solitary small fish glides through water, exhibiting a fluid, moderate pace."
MVI_0292_prores_scene_001,/Volumes/CORSAIR/SCENES/MVI_0292_prores_scene_001_hap.mov,11.01,29.97002997002997,320x240,33.808,18.199,dynamic,cool,"airplane_window, blue_sky, colorado, mountains, nevada, saguaro_national_park, white_clouds","dynamic, high_angle, natural_light","expansive, tranquil","air, glass, stone","#a2cddd, #777b6e, #4a5a49",blue sky with white clouds in the sky | a view from the window of an airplane as it passes over the mountains of nevada | a mountain range in the state of colorada | saguaro national park in colorado,"View from airplane window revealing mountains of Nevada with blue sky and clouds above, transitioning to Colorado range and Saguaro National Park."
IMG_8909_prores_scene_001,/Volumes/CORSAIR/SCENES/IMG_8909_prores_scene_001_hap.mov,18.5,23.976023976023978,1920x1080,13.941,10.868,moderate,cool,"bokeh, close_up, light, reflection, water","background_blur, foreground_focus, light_patterns, reflective_surface","calm, cool, serene","light, water","#f8f8f8, #8fa7ae, #c6cdce","a close-up of the reflections of light on water | bokeh light reflections in the water | a close-up of an object in the foreground | bokeh, light, and shadows","Close-up of water surface with soft bokeh light reflections. An object slightly blurred in the foreground. Calm water ripples causing moderate perceptual motion, imbued with a cool color mood."
2014-11-08 16.35.23_prores_scene_001,/Volumes/CORSAIR/SCENES/2014-11-08 16.35.23_prores_scene_001_hap.mov,2.52,29.97002997002997,1080x1920,3.967,0.0,still,warm,"gradient, horizon, reflection, reflections, sea, sunrise","balance, gentle_rise, static, transition","serene, tranquil, warm_lighting","natural_light, sky, water","#ceb68f, #222120, #756a5a",a sun rising over the sea | a sunrise or sunset over the sea,"The scene displays the sun at the crest of a gentle rise, seemingly balanced delicately on the horizon where the sea meets the sky. The water reflects the sunlight, causing the sea to shimmer with a palette of oranges, reds, and yellows. The sky is painted with gradients of the same warm colors, transitioning softly into the coolness of the distant heavens. There is no discernible movement, implying a tranquil and serene moment. Lighting conditions hint at the early hours of the day, with the sun providing a soft, diffused light as it rises."
4_prores_scene_001,/Volumes/CORSAIR/SCENES/4_prores_scene_001_hap.mov,7.4,30.0,2160x3840,20.216,174.782,active,cool,"airplane_window, clouds, serene, sky, view","cool_lighting, drifting_motion, expansive, soft_lighting, steady_glide","peaceful, soothing","air, cloud, glass, metal","#aabac2, #373948, #888b8f",a view from the window of an airplane,"A serene expanse of the sky viewed through an airplane window presents scattered clouds drifting slowly across the azure canvas. The gentle motion of the clouds contrasts with the smooth, steady glide of the plane, offering a silent spectacle to the observer. The cool color mood is established by the dominance of the sky's blues and the whites of the meandering clouds, with occasional patches of earth tones from the ground far below. Subdued sunlight filters through, casting a soft, natural light across the scene, contributing to the calming atmosphere."
00_0015_2013-12-28_003949_prores_scene_001,/Volumes/CORSAIR/SCENES/00_0015_2013-12-28_003949_prores_scene_001_hap.mov,4.31,29.97002997002997,720x480,9.612,0.0,moderate,cool,"dusk, monochrome, sledding, snow_path, tree, trees_in_woods, winter_activity, woods","contrast, low_light, monochrome, motion, snow","coolness, dynamic, serenity, tranquility","bare_trees, ice, snow, soft_lighting, wood","#0b0d0c, #242b31, #545b63",sledding down a snowy path | a tree in the woods at dusk | a black and white image of trees in the woods,"The scene presents a dynamic winter activity as an individual is sledding down a gently curving snowy path bordered by soft-edged banks of snow. To one side, tucked amidst bare, frost-adorned trees, a solitary tree stands slightly more prominent as the sky, tinged with the subtle purples and blues of dusk, crowns the forested backdrop. The dwindling natural light casts soft shadows, creating a serene yet chilly atmosphere. A separate depiction offers a monochrome perspective of the woods, where the intricate network of tree branches form stark contrasts against the white snow, evoking a timeless and tranquil stillness."
C0027_prores_scene_001,/Volumes/CORSAIR/SCENES/C0027_prores_scene_001_hap.mov,9.84,23.976023976023978,1920x1080,3.021,0.924,still,cool,"empty_room, illuminated, light_sculpture, low_light, monochrome, no_people","contrast, minimalist, shadows, soft_lighting, still_life, symmetrical","calm, cool_lighting, serene, solitude, static","dark, light_sources","#212122, #080508, #afbfb2",a black and white image of an empty room with lights on | an image of a light sculpture in the dark,"The image portrays an austere room devoid of furnishings or occupants. The walls are bare, and the room's only features are the palpable textures of the surface materials and the punctuating presence of lights that are currently illuminated, casting an even glow across the space. The second image captures the essence of a light sculpture against the opaque shroud of darkness, visible as a complex intertwining of illuminated lines and shapes that are seemingly suspended in the void. The absence of movement suggests a moment frozen in time."
00_0037_2013-12-28_012432_prores_scene_001,/Volumes/CORSAIR/SCENES/00_0037_2013-12-28_012432_prores_scene_001_hap.mov,22.61,29.97002997002997,720x480,10.797,67.709,moderate,warm,"forest, hill, landscape, snow, snowfall, trees, winter, woods","background, clusters, earth, slope, snow_cover","cozy, inviting, serene, tranquil, undisturbed","organic, snow, wood","#d7d0c5, #847f76, #fcfbf9",a snow covered hill with trees in the background | a snowy day in the woods | a snow covered forest with trees and trees | a winter scene with snowy trees and snow on the ground,"A picturesque landscape dominated by a gently sloping hill blanketed in pristine snow, with clusters of trees standing at intervals in the background. The woods exude a serene and undisturbed quality, suggesting that it is indeed a snowy day. The forest appears dense, with the trees closely packed, their branches heavy with layers of snow. In the foreground, the snow-covered ground adds to the winter scene's tranquility. While the overall motion is moderate, hints of movement may come from a soft snowfall or branches swaying gently in the breeze. The lighting casts a warm glow despite the cold surroundings, likely from the angle of the sun or the reflection of light on the snow, creating a visually inviting and cozy atmosphere."
MVI_0580_prores_scene_001,/Volumes/CORSAIR/SCENES/MVI_0580_prores_scene_001_hap.mov,26.3,29.97002997002997,1280x720,16.301,8.68,active,cool,"eruption, geyser, hot_springs, iceland, volcano","crater, motion, steam, video_footage, water","dramatic, forceful, natural_wonder","geothermal, rock, vapor","#aeaeae, #5d6367, #84888a",a geyst hot springs in iceland stock video footage | lava erupts from a geyst - video  | a geyser with steam rising from the water | geyser erupting from a volcanic crater,"Video depicts a geyser in Iceland, with steam and water erupting vigorously from a volcanic crater."
IMG_0332_prores_scene_001,/Volumes/CORSAIR/SCENES/IMG_0332_prores_scene_001_hap.mov,3.1,21.33,872x652,15.338,0.0,active,cool,"dusk, fire_pit, flames, garden, landscape, plants, twilight","central_focus, contrast, lighting, movement, outlines","contrast, dynamic, restful","fire, smoke, vegetation, wood","#74a1db, #151922, #bb3438",a fire in the garden at dusk | a fire pit in the middle of the image,"The garden is shrouded in twilight, with the central focus on a fire pit where flames dance and flicker vigorously against the encroaching night. The sky shows remnants of daylight with cool hues of indigo and mauve blending into the shadowy landscape. The garden itself is barely visible, with the outlines of plants soft and indistinct in the dim light. The fire's crackling movement provides a stark contrast to the stillness of the dusk, creating an interplay between the restful setting and the dynamic fire."
00_0021_2013-12-28_005311_prores_scene_001,/Volumes/CORSAIR/SCENES/00_0021_2013-12-28_005311_prores_scene_001_hap.mov,51.71,29.97002997002997,720x480,40.63,51.697,dynamic,cool,"ice, icicles, rock_wall, tree, water_droplets","bare_branches, elongated_shapes, glittering, transparency","serenity, tranquility","light, rock, water, wood","#b7cad8, #272723, #818e99",icicles hanging from a rock wall | icicles hanging from a tree branch,"An array of slender, transparent icicles dangle delicately from the rugged underside of a rock wall, catching the light in a cool, glittering display. Adjacent to this, icicles of varying lengths hang from the bare, wooden fingers of a tree branch, seemingly frozen in a still dance. The scene is dynamic as droplets of water intermittently fall from the tips of the icicles, suggesting a subtle, almost imperceptible swaying motion. The overall color mood is cool, dominated by the icy blues and whites of the icicles against the muted backdrop. The emotional tone is serene and tranquil, underscored by the quietude of the scene. Subdued lighting likely from an overcast sky enhances the cold, crisp ambiance."
GP040496_prores_scene_001,/Volumes/CORSAIR/SCENES/GP040496_prores_scene_001_hap.mov,483.5,23.976023976023978,3840x2160,2.935,0.067,still,cool,"cool, grass, landscape, monochrome, park, serenity, soft_lighting, solitude, trees","absence_of_people, expanse, overcast_shadows, scattered, soft_shadows, static, uncrowded","calm, peaceful, serenity, solitude, static","grass, monochrome, natural_elements, trees","#7993ae, #494c46, #b5c6d2",a field of grass with trees and grass | a city park with trees and grass | a black and white image of an empty field | a black and white image of an empty field with trees and grasses | a black and white image of an empty parking lot,"An uncrowded, monochrome landscape showcasing an expanse of grass possibly in a serene park-like setting with scattered trees. The absence of people or significant objects lends a feeling of solitude. The image is still, indicating no apparent movement, and displays a cool color mood, with overcast or diffused lighting creating soft shadows."
IMG_3299_scene_001,/Volumes/CORSAIR/SCENES/IMG_3299_scene_001_hap.mov,9.8,30.0,2160x3840,41.598,39.86,dynamic,cool,"forest, natural_light, snow, trees, winter","dappled_light, shadows, woodland","coolness, serenity, tranquility","light, snow, wood","#777f8c, #313744, #c0c7d2",the sun shines through trees in a snowy forest | a tree in the woods with snow on the ground,"Weak sunlight filters through the sparse canopy of a snow-laden forest, casting a dappled pattern on the white blanket below. Sunbeams dance as they pierce the cool air, imbuing the scene with a serene yet vibrant energy."
MVI_0546_prores_scene_001,/Volumes/CORSAIR/SCENES/MVI_0546_prores_scene_001_hap.mov,91.33,29.97002997002997,1280x720,33.919,44.93,dynamic,cool,"bison, grizzly_bear, montana, nature, nevada, wildlife, yellow_river, yellowstone","animal, landscape, park, river, snow","majestic, serene, wild","fur, grass, snow, water","#686d5d, #a1abad, #f1f5f6","a group of bisons grazing in the snow | yellow river in yellowstone national park, nevada, united states | a grizzly bear standing on the side of the river in yellowstone national park | a bison grazes in the grass | a view of the yellowstone river in the national park in montana, united states | a lone grizzly bear standing on the banks of yosemite river","Bisons graze in snow-curled fields, a grizzly surveys the Yellow River in Nevada, and the Yellowstone flows tranquilly in Montana, flanked by another bear."
