video_id,file_path,duration,frame_rate,resolution,motion_score,motion_variance,motion_tag,mood_tag,semantic_tags,formal_tags,emotional_tags,material_tags,dominant_colors,semantic_caption,ai_description
00_0020_2013-12-28_004805_prores_scene_001,/Volumes/CORSAIR/SCENES/00_0020_2013-12-28_004805_prores_scene_001_hap.mov,53.51,29.97002997002997,720x480,35.987,46.974,dynamic,warm,"ecosystem, grass, ice, icicles, lichen, moss, rock, stream, tree_stump, water_flow","close_up, gentle, rugged, sparkling, understory, verdant","serene, tranquil, vibrant, warm_lighting","ice, stone, water, wood","#3e3c22, #dddcd1, #7d7c62",a small stream of water flowing through moss and grass | icicles on a rock stock video footage | a close-up of moss and lichen growing on the ground | moss and grasses on a rock | ice clings to a rock | moss and lichens on a rotting tree stump,"A gentle brook meanders through a verdant understory, its waters caressing soft mats of moss and tender grasses. Nature's jewelry, icicles, adorns a rugged rock beside the flow, sparkling under a tender warmth despite chill's touch. Nearby, a rich tapestry of moss and lichen clings intimately to the earth, an intricate close-up revealing the vibrant mini ecosystem. On a solitary rock, verdure thrives, amidst grasses that sway subtly, graced by frost's kiss. Water's chill solidifies on stone, manifesting as ice that grips tenaciously within this serene landscape. Life and decay find union upon an ancient tree stump, now host to a flourishing cover of moss and lichens, evidence of an everlasting cycle."
IMG_3294_scene_001,/Volumes/CORSAIR/SCENES/IMG_3294_scene_001_hap.mov,370.68,30.0,1080x1920,35.354,2.441,dynamic,neutral,"close_up, rapids, river, water_splashing, waterfall, waves","close_up, high_dynamic, nature, water",neutral,water,"#999990, #66665c, #ccccc5",close up view of a waterfall in the river | close up view of a river with rapids and waves | a close-up view of the water splashing into the river,"Water forcefully cascades down, forming a waterfall with frothy white currents, amidst a river with rapid waves, and droplets visibly splashing back into the river."
2015-04-30 11.55.54_prores_scene_002,/Volumes/CORSAIR/SCENES/2015-04-30 11.55.54_prores_scene_002_hap.mov,5.97,30.0,128x384,8.354,31.742,moderate,cool,"face, man, colorful","clear_visibility, motion","calm, cool, serene","light_diffusion, water_texture","#0ce8eb, #16c84f, #202f8b",a fish swims in the water,"A solitary fish glides fluidly through the clear water, its fins undulating with purposeful yet serene movements."
2014-07-23 20.52.10_prores_scene_001,/Volumes/CORSAIR/SCENES/2014-07-23 20.52.10_prores_scene_001_hap.mov,15.1,29.97002997002997,1920x1080,27.109,314.247,active,cool,"centered_composition, clouds, field, motion, plane, sky, solitude, tree","aerial_motion, horizontal_line, natural_elements, overcast_lighting, static_vs_dynamic, symmetry","cool_lighting, isolation, serenity","cloud_water_vapor, metal, organic, wood","#8389ca, #2e323c, #e3e7fd",a lone tree in the sky | a tree in the middle of the field | a plane flying in the sky | a lone tree in the middle of the frame | a cloudy sky with clouds in the sky,"A solitary tree stands erect in the center of an expansive field, its branches swaying slightly. Above, a plane glides across a cool, overcast sky, leaving a faint trail in its wake. The clouds are scattered, providing a dynamic backdrop to the stillness of the tree. The scene is marked by a degree of motion from the plane's travel and the rustling tree, contrasting with the otherwise serene landscape. The lighting is diffuse, with the clouds muting the brilliance of natural light."
Untitled7_prores_scene_004,/Volumes/CORSAIR/SCENES/Untitled7_prores_scene_004_hap.mov,76.91,29.97002997002997,654x480,46.926,231.725,dynamic,cool,"bird, branch, nature, oak_tree, perched","close_up, depth_of_field, perceptual_motion","curiosity, serenity, tranquility","bark, feathers, foliage","#484c48, #90999f, #d4e7f2",a bird perched on the branch | a close up of an animal's face | a bird perched on the limb of an oak tree,"A bird clutches a branch firmly, tilting its head curiously, feathers ruffled by a gentle breeze. Its eyes glisten as the cool, diffused light gives the scene a tranquil ambiance."
pre-ascent-waves_scene_003,/Volumes/CORSAIR/SCENES/pre-ascent-waves_scene_003_hap.mov,24.22,29.97002997002997,1920x1080,54.091,40.261,dynamic,cool,"aerial, ocean, rocky_shore, waves","elevated_perspective, motion, wide_shot","cool, intense, serene","natural_light, rock, water","#182425, #6c7073, #c5c1c3",a view of the ocean from above - sea wave crashing into the rocky shore | a view of the ocean from the sky -  | aerial view of the sea - ocean wave motion stock video footage,Elevated view of vast ocean as waves rhythmically collide with a rugged coastline under overcast lighting.
MVI_0452_prores_scene_002,/Volumes/CORSAIR/SCENES/MVI_0452_prores_scene_002_hap.mov,5.13,29.96,1280x720,29.856,288.337,active,cool,"lake, mountains, nature, park, rocks, shore","landscape, panorama, rocky_terrain, waterscape","majestic, serene, tranquil","natural_light, stone, water","#535e67, #bfcbd6, #8193a3","a view of the grand teton national park in montana, canada | a body of water | a rocky shore with rocks and boulders",Grand Teton National Park displays cool-hued mountains looming over a placid lake with a jagged rocky shore.
Untitled8 copy_prores_scene_010,/Volumes/CORSAIR/SCENES/Untitled8 copy_prores_scene_010_hap.mov,6.29,29.97002997002997,704x480,61.725,244.985,dynamic,cool,"forest, monochrome, plane, sky, trees","background, contrast, foreground, high_angle, monochrome","nostalgic, subdued, tranquil","digital, photography","#3f3e40, #e4e3e7, #88848b",a plane flying over trees | a black and white image of trees in the forest | a black and white image of an airplane flying in the sky | a tree with leaves and branches in the foreground,"A grayscale scene depicting a plane in the upper frame flying over dense forest canopy below, with a single detailed tree in the foreground standing out."
IMG_6160_prores_scene_001,/Volumes/CORSAIR/SCENES/IMG_6160_prores_scene_001_hap.mov,7.4,30.0,1920x1080,38.618,57.616,dynamic,warm,"buck, deer, fawn, nature, woods","depth_of_field, natural_light, organic_shapes, soft_shadows","serenity, vigilance, warm_lighting","fur, leaves, woodland","#275a2b, #64a766, #cbb799",a deer buck and fawn in the woods | a mother deer and her young fawn in the woods,"In the woods, a deer buck stands with a fawn nearby. Their movements suggest dynamism, as they may be grazing or alert. The woods have a warm color palette, indicating it's likely a sunny day."
disco ball_prores_scene_001,/Volumes/CORSAIR/SCENES/disco ball_prores_scene_001_hap.mov,10.4,30.0,640x1136,8.233,22.741,moderate,cool,"background_lights, cool_lighting, disco_ball, low_light, object, upward_glow","color_contrast, cool_lighting, motion, shadowed_areas, soft_lighting","festive, lively, serene","glass, metal, shiny_surface","#160c9e, #07044a, #3f18f6",a blue light shining on an object in the dark | a blue disco ball with blue lights in the background | a blue light is coming from the bottom of the image,"An object is bathed in a gentle stream of blue light against a dark backdrop, while a blue disco ball casts an array of small blue lights throughout the background, creating a dynamic and slightly festive atmosphere. A subtle upward blue glow suggests a light source located at the bottom of the frame, contributing to the scene's serene yet lively visual rhythm."
IMG_3532_prores_scene_001,/Volumes/CORSAIR/SCENES/IMG_3532_prores_scene_001_hap.mov,14.8,29.97002997002997,1920x1080,30.658,45.624,dynamic,warm,"decomposition, forest, fungi, oak_tree, rotting_logs","beams_of_sunlight, dappled_light, shelf-like, sway, umbrella-shaped","cozy, gentle, soft, warm_lighting","bark, decaying_wood, mushroom","#342d2c, #786961, #c4b196",a fungus grows on rotting logs in the forest | a fungus growing on the bark of an oak tree,"A variety of fungi with a mix of warm colors such as yellow, orange, and brown hues, sprouting from the crevices and decomposing fibres of rotting logs resting on the forest floor. Some are umbrella-shaped while others resemble shelves clinging onto the bark of a nearby sturdy oak tree. There's a subtle yet dynamic motion as the fungi slightly sway with the gentle forest breeze. The lighting is soft and dappled, with beams of sunlight piercing through the canopy above, lending a cozy and warm ambiance to the scene."
Planar Pavillions_prores_scene_001,/Volumes/CORSAIR/SCENES/Planar Pavillions_prores_scene_001_hap.mov,13.71,59.94,1920x1080,33.33,1.128,dynamic,warm,"aerial, california_desert, desert_field, deserted_area, grasses, trees","high-angle_shot, landscape","isolation, serenity","sand, vegetation","#bc9261, #573a24, #996f45","an aerial view of the california desert | san francisco, california, united states | an aerial view of a desert field with trees and grasses | a deserted area in the middle of the image | a deserted field with trees and grasses",A high-angle shot captures the warm hues of a deserted Californian desert area with scattered trees and grasses swaying gently in the breeze.
MVI_0420_prores_scene_002,/Volumes/CORSAIR/SCENES/MVI_0420_prores_scene_002_hap.mov,8.68,29.97002997002997,1280x720,30.975,0.513,dynamic,cool,"airplane_window, lake, trees, view","aerial, landscape, natural_light, reflections","coolness, serenity","glass, vegetation, water","#4877a9, #4e543c, #74a8d3",a view of the lake from the window of an airplane | a view of trees and trees from the window of an airplane | a view of the lake in the background,"Through an airplane window, a vast lake with a shimmering surface sprawls below. Clustered trees fringe the water, contrasting with the lake's cool hues. Light diffuses softly overhead."
64175173382__33ADC394-2A16-4A0B-8A61-25193994F498_prores_scene_001,/Volumes/CORSAIR/SCENES/64175173382__33ADC394-2A16-4A0B-8A61-25193994F498_prores_scene_001_hap.mov,1.95,22.63,654x872,27.889,0.0,active,neutral,"grass, hills, landscape, nature, trees, water","canopy, ripple, river, soft_lighting, stream, sway","balanced, serene, tranquil","earth, foliage, vegetation, water","#82896a, #495629, #bdc2c2","a river or stream with trees on either side | a river or stream with trees and grassy hillsides | a river, creek, stream, lake or stream","A serene waterway carved naturally through the land, flanked by lush trees forming canopies over its banks. The gentle flow of the stream or river creates a ripple on the surface, with the murmur of moving water as the main auditory element. On either side of the river, the landscape steadily ascends into grassy hills adorned with patches of various green hues from different types of vegetation. The overall motion is tranquil, with ripples and the subtle sway of leaves and grass in a light breeze. The emotional tone is one of calm and balance, neither melancholic nor overly vibrant. Ambient lighting suggests either an overcast sky or soft sunlight filtered through the trees."
Untitled8_prores_scene_010,/Volumes/CORSAIR/SCENES/Untitled8_prores_scene_010_hap.mov,10.95,29.87,654x480,68.477,236.039,dynamic,neutral,"bird, light, oak, reflection, sky, sunbeam, tree","backlit, natural_light, outdoors","peaceful, serene","feathers, leaves, wood","#eceeeb, #2e332e, #7d807a",rays of light shining through a tree | a bird perched on the branches of an oak tree | a sunbeam reflected in the sky,"Streaming sunbeams pierce through the foliage of an oak, where a bird nestles on a branch, with sunlight reflecting in the sky above."
IMG_3295_scene_001,/Volumes/CORSAIR/SCENES/IMG_3295_scene_001_hap.mov,168.02,59.91,1080x1920,28.837,17.314,active,warm,"fish, ocean, sand_dune, sea, shore, waves","close_up, natural_light, outdoor, water_movement","serene, warm_lighting","foam, sand, water","#aeacae, #473f31, #7c7671","a fish swims in the water -  | a close up view of the ocean waves crashing against the shore | sand dune in the sea - stock photo,  image","A fish glides through water, nearby, ocean waves crash onto the shore, and a sand dune rests in the sea under a warm light."
2014-10-19 18.21.23_prores_scene_001,/Volumes/CORSAIR/SCENES/2014-10-19 18.21.23_prores_scene_001_hap.mov,8.11,120.0,1280x720,17.592,43.547,active,neutral,"forest, grasses, light, motion, nature, row, trees","light_conditions, linear, movement, spatial_layout",neutral,"grass, leaves, wood","#43433c, #9b8c78, #f0f2f4",a row of trees in the forest | a forest of trees and grasses,"A linear arrangement of trees intermingles within a wider expanse of a lush forest. The underbrush is speckled with various species of grasses. Movements in the scene could be the gentle sway of tree branches and the subtle oscillation of grass blades, indicating a presence of a light breeze. The emotional tone is neutral, neither overly calming nor stimulating. Ambient light filters through the tree canopy, creating a balance of light and shadows across the forest floor."
00_0022_2013-12-28_005447_prores_scene_001,/Volumes/CORSAIR/SCENES/00_0022_2013-12-28_005447_prores_scene_001_hap.mov,10.21,29.97002997002997,720x480,39.356,245.438,dynamic,neutral,"cliff, ice, icicles, lake, river, snow, winter","contrast, dynamic, neutral_colors, soft_lighting",latent,"ice, rock, snow","#8d9696, #4e524b, #e9f3f2","snow and ice on a frozen river | ice falls down the side of a rock cliff - icicles stock videos and  footage | ice, snow, sleet and snow | ice falls from a cliff into the river | ice, snow, sleet and snow on a frozen lake in winter","A frozen river stretches through the scene, its surface covered with snow and ice, capturing the latent stillness of a winter landscape. Alongside the river, a rock cliff stands draped in cascading ice formations, with icicles punctuating its rugged face. Periodically, chunks of ice break free, tumbling down the cliff with a subdued crash and splashing into the river below, sending ripples across the otherwise motionless water. The lake nearby shares the river's frozen state, displaying a blanket of snow punctuated by patches of sleet. The dynamic activity of the falling ice contrasts with the static nature of the frozen surroundings. The overall color mood is neutral, with the whites and grays of the winter palette dominating. The sunlight is soft and diffused, possibly due to the overcast sky, which casts a uniform light across the cold landscape."
Drone flyover of fog filled valleys in the Southern Tier of WNY_prores_scene_001,/Volumes/CORSAIR/SCENES/Drone flyover of fog filled valleys in the Southern Tier of WNY_prores_scene_001_hap.mov,196.63,29.97002997002997,1280x720,20.667,81.433,active,cool,"aerial, diffused_light, forest, mountains, valleys","aerial_perspective, cool_palette, diffuse_lighting, landscape, rolling_motion","mystery, serenity, tranquility","mist, natural_light, trees","#2c2f31, #dddbdb, #898c93",aerial view of a forest covered with fog | a view of the mountains and valleys from above,"An expansive forest blankets the undulating terrain, its vastness only broken by swirls of creeping fog that gently roll over the tree canopy. The fog lends a dreamlike quality to the scene, mingling with the verdant greens of the forest to create a cool-toned mosaic. From this elevated perspective, the mountainous landscape reveals itself, with valleys softly disappearing into the mist. The motion of the fog suggests a serene dynamism as it hovers and flows above the forest, suggesting the presence of subtle winds. The lighting is soft and diffuse, likely indicative of either early morning or late afternoon, casting a tranquil and mysterious ambiance over the entire vista."
00_0031_2013-12-28_011001_prores_scene_001,/Volumes/CORSAIR/SCENES/00_0031_2013-12-28_011001_prores_scene_001_hap.mov,54.59,29.97002997002997,720x480,5.056,3.004,moderate,warm,"bird, close_up, foreground, ground, ice, mud, object, perched, rocks, texture","close_up, mixed_textures, motion, natural_light, perceptual_constrast, sharp_focus, warm_lighting","attentive, gentle, tranquil, warm_lighting","feathers, ice, mud, rock","#7a7470, #c0bebe, #575048",a bird perched on the ground | a close-up of ice on rocks | a bird perched on the edge of mud | a close-up of an object in the foreground,"In the foreground, a bird stands grounded, its feathers ruffled by the moderate breeze. Adjacent, the scene transitions to a contrasting texture of ice on rocks, with the translucence catching warm light that infuses the frame with a gentle glow. Nearby, another bird remains poised at the muddy brink, tentative yet attentive. In close proximity, an object is prominently featured in sharp focus, demanding the viewer's immediate attention amidst the softer background. The lighting casts a warm hue across the scene, highlighting the variations in texture from the softness of feathers, the rigidity of ice, and the malleability of mud."
00_0017_2013-12-28_004204_prores_scene_001,/Volumes/CORSAIR/SCENES/00_0017_2013-12-28_004204_prores_scene_001_hap.mov,103.61,29.97002997002997,720x480,29.226,519.892,active,neutral,"forest, icicles, natural_light, nature, rock, snow, trees","composition, lighting, movement, refraction, shadows, translucence","peaceful, quiet, serene","ice, light, snow, stone, water, wood","#d3deda, #0e0f0d, #82857a",icicles hanging from a rock | sun shining through trees in a forest,"A jagged array of transparent icicles dangle precariously from a gray, stone outcropping. Sunlight filters softly through dense forest canopy overhead, casting dappled patterns of light and shadow onto the snow-dusted forest floor. The delicate motion of the icicles is implied, their tips occasionally catching and refracting the sunlight as they slowly melt. The overall color scheme is neutral, defined by the natural hues of the stone, the subtle green of the pine needles, and the soft whites of the snow and icicles. The emotional tone is one of serene, undisturbed nature, while the lighting suggests a clear day with the sun positioned high enough to penetrate the forest's expanse."
IMG_0333,/Volumes/CORSAIR/SCENES/IMG_0333_hap.mov,1.7,22.31,960x720,9.103,0.0,moderate,cool,"fire_pit, flames, woods","cool_color_mood, motion","calm, serene","fire, smoke, wood","#252d34, #f1f8f9, #926a83",a fire pit with flames in the background | a fire pit in the middle of the woods,A fire pit with crackling flames sits in a wooded area. The flickering fire provides a cool-toned yet warm illumination against the evening woods.
GP010503_prores_scene_001,/Volumes/CORSAIR/SCENES/GP010503_prores_scene_001_hap.mov,392.8,23.976023976023978,3840x2160,11.941,14.288,moderate,warm,"central_focus, dusk, fire_pit, flames, garden","background, evening_light, foreground, motion","invigorating, tranquility, warm_lighting","fire, natural_light, smoke","#444233, #b6bfcc, #9a7452",a fire pit with flames in the background | a fire burns in the garden | a view of the fire in the garden at dusk | a fire burns in the middle of the image,"In the scene, a fire pit with dancing flames is prominently situated in a garden setting. The fire's dynamic, moderate motion is the focal point, surrounded by the softening light of dusk that enhances the overall warm color mood. The background is less defined due to the gathering evening gloom."
00_0023_2013-12-28_005751_prores_scene_001,/Volumes/CORSAIR/SCENES/00_0023_2013-12-28_005751_prores_scene_001_hap.mov,33.71,29.97002997002997,720x480,26.659,22.832,active,cool,"cold, ice, macro_photography, snow, tree_branch","close_up, contrast, pattern, soft_lighting, texture","crisp, serene, tranquil","ice, snow, wood","#3d4149, #8ea6c0, #70849a","a close-up view of ice crystals in the snow | close-up of a tree branch with snow and ice on it | ice crystals - stock photo,  image | a close-up of snow and ice on the ground | ice crystals and snowflakes on a white background","The scene captures a series of macroscopic images showcasing various forms of ice. The center focuses on a sharp, intricate cluster of ice crystals glistening with complex patterns akin to fine lacework. To the left, a tree branch emerges, partially cloaked in a delicate layer of snow and ice, creating a contrast between the organic lines of the wood and the geometric frost. The background is a soft blur of white, hinting at a snowy environment without drawing attention away from the ice details. The motion perceived appears to be the gentle formation and sublimation of the crystals, although the scene is static. The color mood conveys a cool ambiance with blue and white hues prevalent, suggesting a cold temperature. The lighting is diffused and soft, enhancing the visibility of the delicate ice structures without causing harsh reflections."
IMG_8909,/Volumes/CORSAIR/SCENES/IMG_8909_hap.mov,18.44,23.976023976023978,1920x1080,13.817,12.233,moderate,cool,"bokeh, cool_lighting, light_play, night_sky, reflection, water","close_up, composition, contrast, reflection","calm, peaceful, serene","light, sky, water","#93a8b0, #fbfafa, #cbcfd2","a close-up image of bokeh lights in the sky | bokeh light reflections in the water | a close-up of the bokeh in the foreground | bokeh, lighting, and composition of the image | bokeh, light and shadows","Distinguishable bokeh lights scatter across the night sky with subtle motion, reflected crisply in the tranquil water below. The bokeh's hue and the scene's overall cool color mood impart a serene atmosphere, while the interplay of light and shadow enhances the visual depth."
00_0026_2013-12-28_010034_prores_scene_001,/Volumes/CORSAIR/SCENES/00_0026_2013-12-28_010034_prores_scene_001_hap.mov,41.71,29.97002997002997,720x480,5.482,8.508,moderate,cool,"branch, cold, icicles, nature, tree, winter","bluish_hue, diffuse_light, hanging, swaying, tapering, transparent","chill, quiet, static","ice, sky, wood","#20201c, #72808c, #3e4244",icicles hanging from a tree branch,"Transparent icicles dangle from the semi-bare limbs of a dormant tree, their cylindrical shapes tapering to fine points. The overcast sky casts a diffuse light that imparts a chill, bluish hue to the scene, emphasizing the cold temperature. As a gentle breeze stirs, the icicles sway slightly, their motion moderate but perceptible. The surrounding atmosphere feels still and quiet."
Planar Pavillions_prores_scene_006,/Volumes/CORSAIR/SCENES/Planar Pavillions_prores_scene_006_hap.mov,7.45,59.93,1920x1080,31.636,8.085,dynamic,warm,"aerial, california, desert, drone, mountains","landscape, natural_light, open_space, vastness","serenity, solitude, tranquility","rock, sand, sky","#5f412a, #748d9f, #a2784f",a drone flies over the desert in california | an aerial view of a deserted area in the middle of the desert | a desert landscape with mountains in the background,"Drone glides over a vast Californian desert, capturing a barren expanse with rolling sandy terrain. Rugged mountains rise in the distance under a warm, luminous sky."
GOPR0216_prores_scene_001,/Volumes/CORSAIR/SCENES/GOPR0216_prores_scene_001_hap.mov,1.79,59.94,1920x1080,17.874,0.0,active,warm,"grass, leisure, movement, natural_light, park, trees","background, shadows, spatial_layout, warm_lighting","bustling, vibrant, vitality, warm_lighting","foliage, natural_light","#424618, #dddfd2, #999852",a park with trees and grass in the background,"A vibrant park bustling with life, dotted with verdant trees and a lush carpet of grass stretching throughout. The scene brims with dynamic movement, perhaps from children playing or people strolling leisurely across the park. The warm color mood suggests the scene is bathed in the golden hues of either early morning or late afternoon sunlight, casting soft shadows and enriching the vitality of the surroundings."
00_0014_2013-12-28_003909_prores_scene_001,/Volumes/CORSAIR/SCENES/00_0014_2013-12-28_003909_prores_scene_001_hap.mov,17.52,29.97002997002997,720x480,42.183,52.908,dynamic,warm,"beams, forest, light, rays, shadow, sun, tree","dynamic, gentle, rhythmic, rustling, swaying","serene, tranquil, warm_lighting, welcoming","leaves, natural_light, wood","#25241b, #f5edde, #80715f",the sun shining through a tree | rays of light shining through trees,"A tranquil forest scene where the sun filters through the lush canopy of a tree, casting golden beams of light in multiple directions. The branches sway gently, creating a rhythmic dance of light and shadow on the ground below. The leaves rustle softly, adding to the dynamic movement within the space. Light filters down in warm hues, contributing to the serene and welcoming emotional tone of the scene."
00_0010_2013-12-28_002935_prores_scene_006,/Volumes/CORSAIR/SCENES/00_0010_2013-12-28_002935_prores_scene_006_hap.mov,10.68,29.97002997002997,720x480,52.963,436.184,dynamic,neutral,"bare_branches, forest, leaves, natural_light, trees, woods","arboreal, luminous, natural_light, shadow_play, sylvan","calming, peaceful, serene","bark, foliage, light, wood","#858886, #f3f6f6, #414741",a forest with trees and trees in the background | a tree in the woods with bare branches and leaves | the sun shines through the trees in a forest,"A serene forest setting where sunlight filters through the dense canopy of trees. In the woods, a distinct tree stands with its bare branches amidst others with leaves. The light dapples the forest floor, creating a dance of light and shadow. The emotional tone is peaceful and calming. The sunlight provides natural illumination, casting subtle hues across the scene."
